id,url,date,title,location,description,info,horaires,salairemin,salairemax,entreprise,experience,contrat,debutant
1041339,https://candidat.pole-emploi.fr/offres/recherche/detail/1041339,2024-02-08,Offre d'emploi Data analyste informatiquee (H/F) (IT) / Freelance - 59 - LILLE - 1041339 | Pôle emploi,59 - LILLE,"Insitoo Freelance, facilitateur du freelancing depuis 2007, recherche pour son client en direct un Data Analyste (H/F).
Les missions attendues par le Data Analyste (H/F) sont :
Nous recherchons un Data Analyste dont les missions seront :
? Reprendre les échanges avec les entités concernées pour adapter/définir le périmètre
d?application des requêtes.
? Développer les requêtes sous SAS et fournir des extractions répondant aux besoins des analystes.
Compétences techniques et fonctionnelles attendues :
- Programmation SAS - Indispensable
Cette mission vous intéresse ? N?attendez plus pour postuler !
Retrouvez nous sur notre page linkedin : Insitoo
Et retrouvez le détail de la mission sur notre site internet : www.insitoo.com","
Profession libérale

Emploi non salarié
",unspecified,unspecified,unspecified,Unspecified,Débutant accepté,Profession libérale,True
1041015,https://candidat.pole-emploi.fr/offres/recherche/detail/1041015,2024-02-08,Offre d'emploi Senior data analyste informatique (IT) / Freelance (H/F) - 92 - NANTERRE - 1041015 | Pôle emploi,92 - NANTERRE,"TEKsystems recherche un senior data analyst pour une pré-embauche avec 6 à 9 mois de prestation avant internalisation.
Démarrage : fin février
Missions principales :
Au sein d?une équipe de 5 personnes, vous aurez pour missions de :
 Collaborer avec les métiers en identifiant leurs problématiques opérationnelles afin d?y répondre avec des analyses et éléments chiffrés (par exemple campagnes commerciales, segmentation clientèle, analyses de saisonnalité, comportements clients)
 Mener les analyses nécessaires à l?optimisation des actions d?acquisition de nouveaux clients et de développement de valeur de notre parc à destination de nos vendeurs Terrain et Télévente 
 Accompagner la stratégie produit par des analyses de compréhension d?usage de nos solutions 
 Etablir des tableaux de bord interactifs (dataviz) de pilotage commercial facilitant les prises de décision et le pilotage de la performance à différents niveaux (management, opérationnel)
 Contribuer activement à la structuration de la vision 360 des clients et prospects : exploration de nouvelles data en vue d?ajouter de nouvelles dimensions, rédaction de spécifications avec le PO et recette data
 Contribuer à la documentation afin de faciliter le transfert des compétences 
Compétences / Aptitudes clés attendues :
 Excellente maitrise d?au moins un des outils/langages suivants : SQL, R, Python
 Vous maitrisez des outils de BI tels que Alteryx, Tableau, Power BI, Data Studio","
Profession libérale

Emploi non salarié
",unspecified,unspecified,unspecified,Unspecified,Débutant accepté,Profession libérale,True
1041002,https://candidat.pole-emploi.fr/offres/recherche/detail/1041002,2024-02-08,Offre d'emploi Data analyste informatique (3 jours sur site à Dunkerque) (IT) / Freelance (H/F) - 59 - DUNKERQUE - 1041002 | Pôle emploi,59 - DUNKERQUE,"Suite au projet décarbonisation, l?équipe Data recherche un Data analyst avec une expérience sur des sujets autour de l?environnement. 
Notre client recherche un consultant ayant participé à des projets d?envergure avec un fort impact environnemental afin de les accompagner sur le projet Transition. 
C?est un projet à très forte vision stratégique, quel est l?impact du projet de transformation sur l?entreprise.
2 jours TT par semaine (Lundi et Vendredi) 
Environnement technique : Spark, scala, cloudera, Hive ...
Profil technico fonctionnel recherché
Visibilité sur ce projet jusqu?au 1er trimestre 2025, avec sûrement un retard jusqu?à milieu d?année 2025.
3 jours sur site non négociable","
Profession libérale

Emploi non salarié
",unspecified,unspecified,unspecified,Unspecified,Débutant accepté,Profession libérale,True
1040641,https://candidat.pole-emploi.fr/offres/recherche/detail/1040641,2024-02-08,Offre d'emploi CDI - DATA ANALYST SENIOR DROM - (F/H/X) (H/F) - 92 - ISSY LES MOULINEAUX - 1040641 | Pôle emploi,92 - ISSY LES MOULINEAUX,"Bienvenue chez CANAL+ Group ! Séries, films, documentaires, émissions, sports, Ce qui nous tient à cœur cest de créer les meilleurs contenus et une expérience immersive pour nos millions dabonnés: émotions et sensations garanties ! Et si vous passiez derrière lécran? Vous trouverez forcément votre place parmi nos 7 600 passionnés dans le monde!
CANAL+INTERNATIONAL est la filiale du GROUPE CANAL+ en charge de l'International et de l'Outremer français. CANAL+INTERNATIONAL est présent sur plus de 40 territoires en Afrique Subsaharienne, en Europe de l'Est, en Asie et en Outremer ,et dispose dun parc de près de 16 millions dabonnés. En forte croissance depuis plusieurs années, le GROUPE poursuit son expansion avec l'ouverture de nouvelles filiales, la diversification de ses activités à l'international, et un nombre croissant de collaborateurs (+ de 4500 collaborateurs dans le monde)
 Au sein de la Direction Commerciale et Marketing de CANAL+INTERNATIONAL, la Direction Analyse & Pilotage de la Performance occupe un rôle clé dans la prise de décision. Les data analysts qui la composent mettent à profit toutes leurs compétences pour :
- Rendre disponible les dashboards de suivi de KPIs à lensemble des équipes de CANAL+INTERNATIONAL partout dans le monde via notre application #Data4all disponible sur PowerBI
- Transformer les data en inputs et recommandations business, et aider les équipes dans leurs prises de décisions
Les sujets sont nombreux et variés et touchent quasiment tous les métiers : analyse des schémas de promotion, estimation dimpact des nouvelles offres et services, analyse de la performance de nos contenus, analyse des performances de notre marketing direct, Léquipe propose et développe également les outils qui permettront daccroître la connaissance de nos abonnés, en exploitant lensemble des data à disposition. La richesse de notre database vient de la variété des données collectées, allant des données de contrats aux données de navigation et dusage sur nos décodeurs et notre application myCANAL. Léquipe exploite aussi les outils de machine learning pour identifier des profils dabonnés et contribuer à la personnalisation de nos actions marketing.
 Rattaché / Rattachée à la direction dAnalyse et du Pilotage de la Performance, le Data Analyst DROM a un rôle essentiel dans la prise de décisions des équipes business qui opèrent sur le périmètre Outremer.
 Et vos missions :
- Développer/maintenir les dashboards de suivi de KPIs hébergés dans notre application #Data4all, avec laide de notre cellule dexperts PowerBI opérant depuis la Pologne
- Exploiter la richesse des données à sa disposition pour les transformer en recommandations business qui aideront à la prise de décision
- Être le point dentrée de léquipe sur des projets danalyse Outremer
- Présenter les résultats danalyses aux équipes concernées en faisant preuve de pédagogie et dexpertise
- Proposer/créer les outils de scoring/segmentation qui contribueront à mieux connaître nos profils dabonnés et personnaliser nos actions marketing
 Et si on parlait de vous ?
- Bac+4-5 en statistiques/datamining/data science ou école de commerce/ingénieur avec spécialisation data
- Première expérience de 4 ans minimum en tant que data analyst
- Forte appétence pour lanalyse des données au service de prises de décisions business
- En mesure dexploiter les outils de manipulation de données (SQL, SAS enterprise guide, Python) et de construction de dashboards (PowerBI).
 Les +
- Un abonnement CANAL+ pour être incollable sur nos univers !
- Des avant-premières de films et séries dans notre salle de cinéma
- Des visites de nos plateaux et des participations à nos émissions
- Participation éressement
- CSE attractif : chèques vacances et noël, prime mariage / pacs / naissance, réduction billetterie sport / voyages / loisirs, prise en charge dune partie de votre abonnement sportif, 
- Et parce que nous voulons vous aider à vous épanouir et vous perfectionner : des formations régulières, des participations à des conférences en interne ou en externe,  !
 Et le télétravail dans tout ça ? Vous pourrez en bénéficier jusquà 2 jours par semaine !
En tant que média, producteur et distributeur de contenus, le Groupe CANAL+ a une responsabilité particulière. En interne ou à lécran, nous soutenons une création ambitieuse, inclusive et respectueuse des limites planétaires.
 On agit pour légalité entre les femmes et les hommes, contre toute forme de discrimination ou harcèlement
 On agit pour légalité des chances et linclusion de tous et toutes
 On agit pour réduire notre impact environnemental et éco-concevoir nos produits
Si vous voyez cette annonce, cest que vous avez votre chance et que nous navons pas encore tro","
Contrat à durée indéterminée

Contrat travail
",unspecified,unspecified,unspecified,Unspecified,Débutant accepté,Contrat à durée indéterminée,True
1031622,https://candidat.pole-emploi.fr/offres/recherche/detail/1031622,2024-02-08,Offre d'emploi Responsable du Pôle Data Expertise Comptable H/F - 89 - AUXERRE - 1031622 | Pôle emploi,89 - AUXERRE,"POSTE : Responsable du Pôle Data Expertise Comptable H/F
DESCRIPTION : Dans le cadre du développement de l'activité de l'entreprise, vous pouvez intégrer une entreprise engagée dans les projets novateurs avec un ancrage territorial important. Vous coordonnez et fiabilisez la production des données numériques d'activité comptable avec pour principales missions de :

* Définir les objectifs de traitement des données comptables et d'en gérer les flux.
* Editer un cahier des charges sur les données comptables à collecter.
* Gérer des bases de données ciblées, garantir l'accès des données et mettre en place des supports de sauvegarde avec la DSI.
* Analyser les données triées et rédiger une synthèse de l'analyse.
* Rédiger des rapports pour mettre en place et industrialiser des solutions de collecte, stockage, traitement et restitution de la donnée.
* Contribuer à la définition de la politique de la donnée comptable.
PROFIL : De formation supérieure en informatique, votre maîtrise des NTIC et des flux informatisés, votre esprit méthodique, votre sens relationnel et votre capacité à fédérer seront des atouts pour réussir dans une entreprise en pleine dynamique de modernisation qui reste proche de ses clients.","
Contrat à durée indéterminée

Contrat travail
",unspecified,45000.0,55000.0,Unspecified,Expérience exigée,Contrat à durée indéterminée,False
1031545,https://candidat.pole-emploi.fr/offres/recherche/detail/1031545,2024-02-08,Offre d'emploi Ba Data Market H/F - 75 - PARIS 01 - 1031545 | Pôle emploi,75 - PARIS 01,"POSTE : Ba Data Market H/F
DESCRIPTION : Description du poste
Nous poursuivons notre développement et recherchons actuellement BA Market Data pour intervenir chez un de nos clients.
Votre mission :
Développer et entretenir des relations de proximités avec les lignes métier pour s'assurer de comprendre leur besoin en market data et négocier suivant leurs contraintes.
Apporter une expertise fonctionnelle et une connaissance approfondie de l'industrie des Market Data et de ses spécificités pour répondre aux besoins métiers.
Vous analyserez et challengerez les besoins des clients internes et leur apporterez votre expertise achats tout en garantissant la conformité avec les règles de conduite du Groupe applicables aux relations avec les fournisseurs.
Négocier la reprise des contrats LFAM vers EI dans le cadre des renouvellements ou révision des contrats de Market Data avec les fournisseurs externes pour le compte et au mieux des intérêts des lignes métier.
Suivre la conformité des contrats avec le service EI Juridique et EI Achats
Entretenir des relations avec les fournisseurs afin de comprendre leurs offres et identifier des sources alternatives.
Etre force de proposition d'optimisation en anticipant les risques, les tendances et les opportunités.
Pour chaque contrat, fournir un support contractuel et une synthèse contrat sur les demandes de market data formulées par les lignes métiers
Votre profil :
Diplômé(e) d'un Bac +5 (école de commerce, université ou équivalent), vous disposez d'une bonne connaissance de l'industrie des market data (fournisseurs, type de données, utilisation, droits d'usage).
Une expérience de minimum de 5 ans dans le domaine Market Data dans une autre banque ou chez un fournisseur est fortement souhaitable.
Une connaissance approfondie d'un des domaines suivants sur les services fournisseurs : Bloomberg, S&P, Markit, ESG serait un vrai plus.
Vous disposez de compétences en gestion de la relation avec des clients internes ou des fournisseurs.
Vous connaissez les métiers de l'asset management et les instruments financiers.
Vous aimez travailler en équipe et faites preuve d'autonomie pour rechercher les informations nécessaires et proposer des solutions adaptées.
Anglais courant : communication régulière avec des fournisseurs anglais et américains, et avec certains clients internes.
PROFIL :","
Contrat à durée indéterminée

Contrat travail
",unspecified,unspecified,unspecified,Unspecified,Expérience exigée,Contrat à durée indéterminée,False
169BPKL,https://candidat.pole-emploi.fr/offres/recherche/detail/169BPKL,2024-02-09,Offre d'emploi Data Scientist Junior (H/F) - 75 - Paris (Dept.) - 169BPKL | Pôle emploi,75 - Paris (Dept.),"Dans le cadre d'un projet ambitieux dans la lutte contre la fraude dans le domaine du e-commerce, nous recherchons activement un profil qui correspondra aux attentes suivante:

Responsabilités :
Collaborer avec les équipes pour comprendre les besoins métier et identifier les opportunités d'application de l'analyse de données.
Concevoir, développer et mettre en œuvre des pipelines de données pour l'extraction, le nettoyage, la transformation et la visualisation des données.
Effectuer des analyses exploratoires pour identifier des tendances, des modèles et des insights significatifs.
Développer et mettre en œuvre des modèles de machine learning et des algorithmes de prédiction.
Participer à la conception et à l'implémentation d'architectures de bases de données.
Intégrer les modèles et les analyses dans des applications et des systèmes en production.
Maintenir une documentation précise des processus, des modèles et des analyses réalisées.


Diplôme en ingénierie (Bac +5 ou plus) dans le domaine de l'IT (Computer Science).

Maîtrise de Python, SQL, Neo4j et des bibliothèques couramment utilisées pour l'analyse de données.
Expérience pratique avec des outils de développement et de déploiement de modèles ML/DL sur Dataiku.
Compréhension des concepts de data engineering et des pipelines de données.
Capacité à travailler dans un environnement dynamique et à s'adapter rapidement aux nouvelles technologies et aux nouveaux défis.
Excellentes compétences en communication et en travail d'équipe.

Atouts :
Expérience avec des bases de données NoSQL et Graphs.
Connaissance des outils de conteneurisation et d'orchestration.
Expérience dans la conception de systèmes de recommandation.
Compréhension des principes de l'apprentissage automatique en ligne.
Maîtrise d'autres langues, en particulier le français et l'anglais.

À propos de vous :
Vous êtes un ingénieur passionné par l'analyse de données et l'apprentissage automatique, doté d'un esprit curieux et d'une capacité à résoudre des problèmes complexes. Vous aimez travailler dans un environnement collaboratif où l'innovation est encouragée, et vous êtes prêt à contribuer activement à des projets de données stratégiques qui ont un impact significatif sur l'entreprise.


Date de début : Immédiatement
Télétravail possible
Maîtrise du français et de l'anglais indispensable
Déplacement surtout sur Paris et Lille","
Contrat à durée indéterminée

Contrat travail
",35H Travail en journée,30000.0,40000.0,X-squad,Débutant accepté,Contrat à durée indéterminée,True
168ZJWT,https://candidat.pole-emploi.fr/offres/recherche/detail/168ZJWT,2024-02-09,Offre d'emploi Data scientist - 75 - PARIS 10 - 168ZJWT | Pôle emploi,75 - PARIS 10,"Dans ce rôle, vous travaillerez principalement sur le développement d'algorithmes et de méthodes afin d'aider nos utilisateurs à être plus efficaces dans leur démarchage (lemlist).
Vous veillerez à ce que lempire reste à la pointe des solutions d'apprentissage automatique et de traitement automatique du langage naturel (TALN) au sein de l'entreprise.
Cela implique de se tenir au courant des derniers grands modèles de langage et de trouver de nouvelles façons innovantes d'aider nos utilisateurs à tirer le meilleur parti de nos outils.
Vous plongerez directement dans le processus, en créant rapidement des prototypes, en les améliorant petit à petit, en effectuant des tests approfondis, et en mettant en place ces produits intelligents alimentés par GenAI/LLM pour que les gens puissent les utiliser.
En créant des fonctionnalités plus intelligentes et conviviales, vous contribuerez directement au succès et à l'efficacité des stratégies de démarchage et de communication de nos utilisateurs.
Vous ferez partie de l'équipe Data & Tech et vous rendrez compte à notre Lead Data.
Vous jouerez un rôle crucial dans l'élaboration de notre stratégie de données et interagirez avec des fonctions clés, notamment les équipes Produit et Tech.

Compétences techniques essentielles :
Avoir une expertise spécifique en TALN et une expérience dans l'application et la manipulation de LLM dans des projets de science des données.
Expérience dans la construction et le déploiement d'applications ou de pipelines de modèles de langage large pour améliorer nos produits.
Avoir une certaine compréhension des technologies d'IA générative en termes de formation et d'optimisation des modèles de langage et d'ingénierie de requêtes.
Pouvoir travailler avec confiance avec au moins un langage courant utilisé pour la manipulation de données (Python de préférence) et être familier avec les bibliothèques LLM.

Compétences techniques facultatives :
Connaissance pratique de Git et des principes de contrôle de version.
Connaissance pratique de la plateforme Google Cloud.
Expérience dans le déploiement et l'industrialisation de composants de science des données au sein du projet global.

Adaptabilité : Capacité à travailler sur des projets divers en parallèle et à s'adapter à des priorités changeantes.
Autonomie : Capacité démontrée à résoudre des problèmes de manière indépendante et à mener des solutions de bout en bout.

Langues : Excellente maîtrise de l'anglais et du français.
Rapidité et efficacité : Nous valorisons une livraison rapide. Vous devriez être capable de travailler rapidement sans compromettre la qualité de votre production.
Approche pragmatique : Bien que nous valorisions l'innovation, nous n'engageons pas dans une R&D prolongée. Nous avons besoin de solutions qui peuvent être mises en œuvre rapidement et efficacement. Vous pouvez communiquer des concepts avancés clairement aux parties prenantes techniques et non techniques.
Esprit collaboratif : Expérience dans le travail avec des équipes pluridisciplinaires avec des experts métier et un bilan prouvé de résultats dans un cadre collaboratif.
Mentalité : Une personne naturellement curieuse avec une mentalité de croissance, toujours désireuse d'apprendre et d'innover.","
Contrat à durée indéterminée

Contrat travail
",40H Travail en journée,58000.0,60000.0,Lempire,3 ans,Contrat à durée indéterminée,False
1017742,https://candidat.pole-emploi.fr/offres/recherche/detail/1017742,2024-02-07,Offre d'emploi Data Scientist - en Alternance H/F - 91 - MASSY - 1017742 | Pôle emploi,91 - MASSY,"POSTE : Data Scientist - en Alternance H/F
DESCRIPTION : Vous cherchez à travailler dans une entreprise dynamique où votre travail rime avec impact social et environnemental ? Bienvenue chez nous !

Porteuse de cette ambition, le Datalab Services Financiers et Marchands du groupe Carrefour recrute, dans le cadre de l'essor digital du groupe, un(e) :

Data Scientist (F/H) - en Alternance

Contexte
Cette mission intervient dans le cadre du partenariat Carrefour-Google pour les cas d'usages data et prend place au coeur du projet dédié à la transformation digitale.

Vous aurez l'occasion de participer aux innovations du Groupe Carrefour à travers l'exploration de source de données très riche, d'établir de solides modèles de scoring, et de contribuer à l'innovation du Groupe Carrefour. Parmi les principaux interlocuteurs dans le cadre de cette mission, on compte :
-  Le pôle Data des différents départements / pays
-  Le pôle Marketing France et International, le E-Commerce
-  Le Lab Carrefour-Google, dans le cadre du partenariat pour la transformation digitale

Les missions :- Faire le lien entre les données des différents services financiers, et le département
fidélité
-  Cerner et analyser les besoins métiers
-  Appliquer des solutions de data science sur des cas d'usages précis
-  Participer à la mise en oeuvre du POC à la mise en production
-  Travailler avec différents profils data du groupe (data scientist, data engineer, data
architect, data analyst)
-  Assurer le monitoring des modèles en production
-  Contribuer au développement et à l'amélioration des outils data interne
-  Assurer une veille technologique sur les produits data
Votre profil :  - Vous avez une solide formation en Data Science Bac +5
-  Python, R et SQL rythment votre quotidien
-  Les outils de data visualisation n'ont plus de secret pour vous
-  Connaissance et expertise des modèles analytiques avancés (machine learning & deep learning)
-  Notions des différents modèles d'hébergement des données et de leur exploitation (Cloud, Cloudera, etc)
-  Vous aimer travailler en équipe, dans un écosystème data
-  Force de propositions, flair, audace et bonne humeur sont indispensables
Informations complémentaires :- Lieu de l'alternance : Massy (91) - RER B/RER C Massy-Palaiseau
-  Durée du contrat : 1 an
-  2 jours de télétravail possible après 6 mois d'ancienneté
-  50% du titre de transport pris en charge par Carrefour
-  10 % de remise sur achat
-  Accès aux infrastructures du campus de Massy et à ses nombreux avantages comme la conciergerie, la salle de sport et l'accès à l'application GymLib, une offre de restauration très diversifiée, parking

Vous êtes en quête d'une nouvelle aventure data, dès maintenant, et l'univers del'intelligence artificielle vous passionne ? Cette offre est faite pour vous.

Chez Carrefour, nous avons à coeur de ne passer à côté d'aucun talent et sommes fiers de compter des équipes représentatives de la société dans son ensemble. Nous encourageons ainsi tous types de profils à postuler à cette offre et garantissons un processus de recrutement dénué de toutes formes de discriminations.
PROFIL :","
Contrat à durée déterminée - 12 Mois

Contrat apprentissage
",unspecified,471.74,1747.2,Unspecified,Expérience exigée,Contrat à durée déterminée - 12 Mois,False
