id,url,date,title,location,description,info,horaires,salairemin,salairemax,entreprise,experience,contrat,debutant
4376506,https://candidat.pole-emploi.fr/offres/recherche/detail/4376506,2024-04-02,Offre d'emploi Actuaire Data Scientist Expérimenté - Nanterre - F/H - Etudes socio-économiques (H/F) - 92 - NANTERRE - 4376506 | France Travail,92 - NANTERRE,"Descriptif du poste:
Votre mission si vous l'acceptez.
Au sein de la Direction Collectives et plus particulièrement au sein de la Direction Technique Prévoyance Santé vos missions seront : 

1. Mener des études techniques avancées et innovantes dans les domaines de l'actuariat et de la data :
. R&D sur les données à disposition ;
. Réalisations d'études techniques pour enrichir notre connaissance du risque (Arrêt de Travail, Décès, Santé)
. Créer des outils et services pour nos clients et équipes internes
. Présentation des études aux différents acteurs des projets ;
. Rédaction de notes pour faire avancer notre expertise en Data Science.

2. Participer à la définition de la trajectoire Data & Innovation des Collectives de GGVIE : 
. Définir des projets avec les différentes équipes des collectives (Souscription, Inspection, Opérations,...) pour les accompagner dans leur transformation via la Data ;
. Assurer une mission de veille sur les nouvelles données à acquérir et les innovations du marché.

3. Accompagner les équipes pour se transformer : 
. Définir et prendre en charge les actions de conduite du changement, et notamment des actions de formation (définition des objectifs pédagogiques, création des supports, animation des sessions de formation) ;
. Apporter du support et de l'expertise aux différentes équipes métier des collectives.

Les projets menés par l'équipe demandent une expertise technique et une forte proximité avec les différents services : Souscription, Commerciaux, Direction Finance et Risques, Opérations, MOA, ... 

A titre d'exemple, les sujets traités pourront être :
- Définition de nouvelles normes de tarification en Prévoyance multicritères ;
- Création d'outils au service des équipes de Souscription et Inspection pour les accompagner dans leur campagne de surveillance en utilisant de nouvelles sources de données
- Accompagnement des Opérations, et du Service Médical dans l'optimisation de leur process et la création d'outils en valorisant les Data Internes et Externes
- Enrichissement de notre pilotage du risque via des indicateurs et outils de suivi innovant

Profil recherché:
Vous avez envie de faire grandir vos compétences...
... dans une entreprise qui place l'humain au coeur de ses ambitions ? Vous avez de préférence un BAC +5 en école d'Ingénieur, d'Actuariat ou équivalent universitaire, vous justifiez d'une expérience significative en data et actuariat. 

Vous avez une réelle appétence pour la data, la gestion de projet et la conduite du changement.

Vous maîtrisez SAS, Excel, les outils informatiques et l'exploitation des données. La rigueur, le goût du détail, l'esprit d'équipe, la capacité d'analyse et de communication, de bonnes qualités rédactionnelles sont autant de qualités nécessaires à la bonne tenue du poste.

Pourquoi venir chez nous ?
Parce qu'on est une entreprise, appartenant à un Groupe solide et bienveillant, à l'ambition forte, qui sait que les meilleures idées viennent toujours de vous.

Parce qu'on s'engage dans le développement de nos collaborateurs (groupes de travail, colloques, formations...), le meilleur moyen pour devenir une entreprise toujours plus innovante et responsable.

Parce qu'on se rappelle toujours pourquoi on agit, on sait se laisser le temps de la réflexion pour avancer ensemble dans la meilleure des directions.
Parce qu'on est flexible dans l'organisation du travail (accords télétravail) comme soucieux de votre équilibre vie pro/perso. Et parce qu'on offre de nombreux avantages : CP et RTT, compte épargne-temps, plan d'épargne, resto d'entreprise, comité d'entreprise, mutuelle et prévoyance intéressantes, intéressement (jusqu'à +1,5 mois de salaire).","
Contrat à durée indéterminée

Contrat travail
",unspecified,unspecified,unspecified,Groupama gan vie,Expérience exigée de 2 An(s),Contrat à durée indéterminée,False
4376224,https://candidat.pole-emploi.fr/offres/recherche/detail/4376224,2024-04-02,Offre d'emploi Docteur R&D - Data Scientist / Marketing (RPL) F/H - Projets scientifiques et techniques (H/F) - 75 - PARIS 08 - 4376224 | France Travail,75 - PARIS 08,"Descriptif du poste:

Notre client souhaite intégrer une expertise R&D par le recrutement d'un(e) Docteur R&D (H/F) en Data Science / Machine Learning afin d'adresser les enjeux R&D suivants, en lien avec la plateforme de data marketing.
Au sein de l'équipe Data (3 personnes), vous serez rattaché(e) au CTO, et interviendrez sur le développement de nouveaux algorithmes afin d'optimiser le traitement et l'analyse des données collectées par la société auprès de ses clients.
En particulier, les 1ères missions envisagées portent sur :
* La qualification des personnes au sein des bases de données consommateurs via une approche graphe :
A ce jour, les contraintes d'anonymisation (en particulier la réglementation RGPD) ne permettent pas de connaître l'identité des personnes au sein des bases de données (100 sources de données). Les algorithmes d'IA / Graphes qui seront développés et implémentés visent à traiter le milliard d'informations remontées chaque semaine par différents canaux (cookies, téléphone, mail, .) et à mettre en correspondance les informations d'une même personne, identifier les doublons, ..
* Les modèles d'attribution des campagnes publicitaires
Par des méthodes d'IA de classification / traitement des séries temporelles, vous aiderez les équipes marketings/ agences / commerçants à visualiser l'efficacité de leur campagne publicitaire et en particulier à identifier le canal contributeur de la vente (d'où vient la vente ? suite à la diffusion de quel message publicitaire ? sur quel canal ? qu'est-ce qui a provoqué l'intérêt ? .)
 
Vous travaillerez également en lien avec le président de l'entreprise et les équipes en charge des campagnes marketing, qui par leur vision stratégique et expertise métier, vous accompagneront sur les orientations des travaux R&D à mener et la pertinence des résultats obtenus.
 

Profil recherché:

Nous recherchons un candidat disposant en particulier des compétences suivantes :
* Un Doctorat en Informatique sur une thématique Data Science / Machine Learning;
Vous avez durant vos expériences doctorales / post-doctorales travaillé sur des problématiques de modèles de bases de données orientés graphes et/ou des algorithmes de classification, traitement de séries temporelles ou de données multivariées.
* Vous maîtrisez la programmation informatique permettant de concevoir et d'implémenter l'ensemble de ces algorithmes : une très bonne maîtrise de Python est indispensable, vous portez une attention particulière à la qualité de votre code.
* La connaissance du framework Big Data Spark est un plus.
* Savoir interroger et manipuler différentes bases de données relationnelles (type SQL) et non relationnelles (idéalement MongoDB) afin de récupérer la donnée nécessaire pour la préparation et l'entraînement des modèles.
Nous recherchons un(e) candidat(e) pragmatique qui souhaite sortir de la recherche amont pour s'intégrer dans un poste opérationnel, où la principale qualité demandée sera d'aimer « faire », de produire des résultats concrets, à destination d'utilisateurs réels. Vous devez montrer une réelle sensibilité à la culture du résultat, du produit et de son utilité pour des clients finaux.
Vous êtes de nature entreprenante, vous savez porter des initiatives et être un réel moteur de la stratégie data. Vous êtes capable de vulgariser des concepts complexes à des utilisateurs et de les expliquer avec humilité.
Bon communicant, doté d'un excellent sens du relationnel pour interagir avec une pluralité d'interlocuteurs, vous avez la culture de l'entraide et le sens du travail en équipe.
 
 
 ","
Contrat à durée indéterminée

Contrat travail
",unspecified,unspecified,unspecified,Rd2 conseil,Débutant accepté,Contrat à durée indéterminée,True
4375597,https://candidat.pole-emploi.fr/offres/recherche/detail/4375597,2024-04-02,"Offre d'emploi Data Scientist /X) F/H - Système, réseaux, données (H/F) - 44 - BOUGUENAIS - 4375597 | France Travail",44 - BOUGUENAIS,"Descriptif du poste:


Le groupe Infopro Digital recrute un Data Scientist (F/H/X) en CDI pour rejoindre son entité Vecteur Plus, basée près de Nantes. 

Description de vos missions

En tant que membre clé de l'équipe « Intelligence Marché », vous travaillerez dans un environnement hautement collaboratif et dynamique. 

Vos missions seront les suivantes : 

-Participer aux évolutions des méthodes de traitement de la donnée ;
-Soutenir les missions clients portés par l'équipe de Data Analyst du service Intelligence Marché
-Intervenir sur des projets techniques autour de la Data au sein de Vecteur Plus, de la Business Unit Europe et des équipes Data du Groupe Infopro Digital.



Envie de missions passionnantes au service des professionnels ? 

Chez Infopro Digital, vous évoluez dans un environnement de travail stimulant où vous apprenez en permanence. Vous aurez la chance de travailler avec des équipes multidisciplinaires sur des projets innovants et de vous voir confier de véritables responsabilités. Avec une forte culture entrepreneuriale et plus de 300 métiers, Infopro Digital offre de nombreuses opportunités de carrière.

En savoir plus sur nous 

Infopro Digital est un groupe B2B spécialiste de l'information et des technologies. Présent dans 18 pays, le groupe comprend 4 000 collaborateurs de 55 nationalités. 
Infopro Digital connecte les communautés professionnelles.
Nos marques sont leaders dans les cinq univers clé de l'économie : construction et secteur public, automobile, industrie, risques & assurances et distribution.
Avec nos solutions, les décideurs prennent des décisions éclairées et les entreprises développent durablement leur activité commerciale et leur performance.



Profil recherché:


Le poste de Data Scientist au sein du groupe Infopro Digital est fait pour vous si :

-Vous disposez d'une première expérience significative dans le domaine du traitement de la donnée en BtoB ;
-Vous possédez des compétences en statistiques, en modélisation, en analyse de données, mais également en informatique ;
-Vous connaissez les outils et langages suivants : SAS Institute, AWS, SNOWFLAKE, Python, sources Open Data ;
-Vous êtes reconnu pour votre esprit d'initiative et votre excellente maîtrise du relationnel client.","
Contrat à durée indéterminée

Contrat travail
",unspecified,unspecified,unspecified,Vecteur plus - groupe infopro digital,Expérience exigée de 2 An(s),Contrat à durée indéterminée,False
4420185,https://candidat.pole-emploi.fr/offres/recherche/detail/4420185,2024-04-03,Offre d'emploi Data Ingénieur (H/F) - Lille - 59 - LILLE - 4420185 | France Travail,59 - LILLE,"Description de l'entrepriseBPCE SI est une entreprise informatique du Groupe BPCE. Avec ses 19 implantations en régions, BPCE SI intervient au plus près des établissements bancaires. Chaque jour, plus de 2600 collaborateurs imaginent, inventent, testent des solutions innovantes pour faciliter la vie des utilisateurs des Caisses d'Epargne, des Banques Populaires et de plusieurs filiales et établissements bancaires comme le Crédit Coopératif et la SocFim.A travers l'utilisation de nos solutions bancaires, nous sommes présents dans le quotidien de près de 1 Français sur 2 ! Plus de 80 métiers sont présents au sein de BPCE SI et plus de 50 technologies et langages de développements sont utilisées dans nos solutions bancaires ! Entreprise humaine et engagée, notre politique de Responsabilité sociale de l'entreprise porte des sujets clés comme la mixité, la diversité, le handicap, la qualité de vie au travail et le développement durable. Nous attachons une attention particulière à la réussite de chacun(e). Nos équipes sont accompagnées tout au long de leur parcours et évoluent dans un environnement de travail stimulant pour exprimer leurs talents.Alors, pour booster votre carrière et profiter de la diversité des terrains de jeux que propose BPCE Solutions informatiques et le Groupe BPCE, rejoignez-nous !Poste et missionsAu sein du Produit Socle Data Retail Groupe, vous intervenez dans l'équipe sur des activités de data ingénierie sur le socle de la plateforme Data du groupe BPCE (sur Google Cloud Platform), l'alimentation des données Retail (distributeurs BP & CE), et l'accompagnement des établissements et des équipes IT/métiers du Groupe BPCE, utilisateurs de la plateforme. Sur la base des expressions de besoins auxquelles vous contribuez : Vous définissez les spécifications, concevez, développez et mettez à disposition des solutions logicielles et/ou des corrections sur un périmètre applicatif Datasur la plateforme « Google Cloud Platform » (pour des usages de Data Science et analytics) Vous participez à la résolution des incidents et effectuez le support aux utilisateurs Vous aurez en charge les activités de Data Ingénierie sur l'écosystème Big Data hébergée sur la Google Cloud Platform (GCP) servant aux cas d'usages Data des établissements BP & CE, ou de l'organe Central : Construire les flux d'alimentation de données de la plateforme : alimentation du Datalake avec les données sources des BP et CE ou des données externes (open Data), exposition, sharing, exports. Réaliser/configurer les composants logiciels, les tester, les assembler et les mettre à disposition pour mise en production par les équipes d'infogérance (ops), Assurer le suivi de production, la maintenance corrective ou évolutive des flux d'alimentation et exposition de données dans le Datalake, s'assurer de leur comportement, leur pertinence dans le temps, Etre en support technique des établissements (BP et CE) et des équipes internes BPCE-SI sur les briques applicatives de la plateforme (outils internes et GCP, habilitations.), Assister les Data Scientist et les Data analysts à l'analyse, la préparation des données, l'exposition, le sharing, la connaissance des outils, Construire les outillages nécessaires à industrialiser les flux de données du socle de la plateforme : ingestion, traçabilité, monitoring, sharing, sécurité/conformité (pseudomymisation.), optimisation des capacités techniques (performances). Effectuer les veilles techniques et technologiques qui permettent d'analyser, concevoir et développer les composants, et participer à la mise en place de nouvelles briques techniques. Vous participez également à des activités de Data Analyse : Obtenir des données adéquates, trouver les sources de données pertinentes, faire des recommandations sur les données à consolider, transformer, rapatrier, consolider au sein des couches socle et d'exposition (accessibles directement aux usages avec le Data sharing), Analyser les données pour traduire une problématique Métier. Profil et compétences requisesDe formation Bac +4/+5 spécialisée dans la Data, vous justifiez d'une expérience significative de 2 ans minimum sur un poste similaire dans un contexte agile. Vous maitrisez les compétences techniques suivantes : Développement Big DATA dans le cloud (la connaissance de l'éco systèmeGCP serait notamment apprécié). Data analyse et connaissance de systèmes décisionnels : bonne maîtrisedu SQL (sur des systèmes équivalents à Teradata ou Exadata) Vous avez de l'expérience et/ou êtes appétents sur les compétencestechniques suivantes : Ingénierie/Développement logiciel (la connaissance des principes dedéveloppement autour du langage Python serait un plus) Connaissance des concepts clés liés à la mise en œuvre d'une chaineCI/CD (intégration continue notamment). La connaissance des outils lié àces concepts serait un plus (Jenkins, Bitbucket, Git","
Contrat à durée indéterminée

Contrat travail
",unspecified,unspecified,unspecified,Unspecified,Expérience exigée de 24 Mois,Contrat à durée indéterminée,False
4412669,https://candidat.pole-emploi.fr/offres/recherche/detail/4412669,2024-04-02,Offre d'emploi Data Ingénieur (H/F) - Nantes - 44 - ST HERBLAIN - 4412669 | France Travail,44 - ST HERBLAIN,"Description de l'entrepriseBPCE SI est une entreprise informatique du Groupe BPCE. Avec ses 19 implantations en régions, BPCE SI intervient au plus près des établissements bancaires. Chaque jour, plus de 2600 collaborateurs imaginent, inventent, testent des solutions innovantes pour faciliter la vie des utilisateurs des Caisses d'Epargne, des Banques Populaires et de plusieurs filiales et établissements bancaires comme le Crédit Coopératif et la SocFim.A travers l'utilisation de nos solutions bancaires, nous sommes présents dans le quotidien de près de 1 Français sur 2 ! Plus de 80 métiers sont présents au sein de BPCE SI et plus de 50 technologies et langages de développements sont utilisées dans nos solutions bancaires ! Entreprise humaine et engagée, notre politique de Responsabilité sociale de l'entreprise porte des sujets clés comme la mixité, la diversité, le handicap, la qualité de vie au travail et le développement durable. Nous attachons une attention particulière à la réussite de chacun(e). Nos équipes sont accompagnées tout au long de leur parcours et évoluent dans un environnement de travail stimulant pour exprimer leurs talents.Alors, pour booster votre carrière et profiter de la diversité des terrains de jeux que propose BPCE Solutions informatiques et le Groupe BPCE, rejoignez-nous !Poste et missionsAu sein du Produit Socle Data Retail Groupe, vous intervenez dans l'équipe sur des activités de data ingénierie sur le socle de la plateforme Data du groupe BPCE (sur Google Cloud Platform), l'alimentation des données Retail (distributeurs BP & CE), et l'accompagnement des établissements et des équipes IT/métiers du Groupe BPCE, utilisateurs de la plateforme. Sur la base des expressions de besoins auxquelles vous contribuez : Vous définissez les spécifications, concevez, développez et mettez à disposition des solutions logicielles et/ou des corrections sur un périmètre applicatif Data sur la plateforme « Google Cloud Platform » (pour des usages de Data Science et analytics) Vous participez à la résolution des incidents et effectuez le support aux utilisateurs Vous aurez en charge les activités de Data Ingénierie sur l'écosystème Big Data hébergée sur la Google Cloud Platform (GCP) servant aux cas d'usages Data des établissements BP & CE, ou de l'organe Central : Construire les flux d'alimentation de données de la plateforme : alimentation du Datalake avec les données sources des BP et CE ou des données externes (open Data), exposition, sharing, exports. Réaliser/configurer les composants logiciels, les tester, les assembler et les mettre à disposition pour mise en production par les équipes d'infogérance (ops), Assurer le suivi de production, la maintenance corrective ou évolutive des flux d'alimentation et exposition de données dans le Datalake, s'assurer de leur comportement, leur pertinence dans le temps, Etre en support technique des établissements (BP et CE) et des équipes internes BPCE-SI sur les briques applicatives de la plateforme (outils internes et GCP, habilitations.), Assister les Data Scientist et les Data analysts à l'analyse, la préparation des données, l'exposition, le sharing, la connaissance des outils, Construire les outillages nécessaires à industrialiser les flux de données du socle de la plateforme : ingestion, traçabilité, monitoring, sharing, sécurité/conformité (pseudomymisation.), optimisation des capacités techniques (performances). Effectuer les veilles techniques et technologiques qui permettent d'analyser, concevoir et développer les composants, et participer à la mise en place de nouvelles briques techniques. Vous participez également à des activités de Data Analyse : Obtenir des données adéquates, trouver les sources de données pertinentes, faire des recommandations sur les données à consolider, transformer, rapatrier, consolider au sein des couches socle et d'exposition (accessibles directement aux usages avec le Data sharing), Analyser les données pour traduire une problématique Métier. Profil et compétences requisesDe formation Bac +4/+5 spécialisée dans la Data, vous justifiez d'une expérience significative de 2 ans minimum sur un poste similaire dans un contexte agile. Vous maitrisez les compétences techniques suivantes : Développement Big DATA dans le cloud (la connaissance de l'éco système GCP serait notamment apprécié). Data analyse et connaissance de systèmes décisionnels : bonne maîtrise du SQL (sur des systèmes équivalents à Teradata ou Exadata) Vous avez de l'expérience et/ou êtes appétents sur les compétences techniques suivantes : Ingénierie/Développement logiciel (la connaissance des principes de développement autour du langage Python serait un plus) Connaissance des concepts clés liés à la mise en œuvre d'une chaine CI/CD (intégration continue notamment). La connaissance des outils lié à ces concepts serait un plus (Jenkins, Bitbuck","
Contrat à durée indéterminée

Contrat travail
",unspecified,unspecified,unspecified,Unspecified,Expérience exigée de 24 Mois,Contrat à durée indéterminée,False
4421688,https://candidat.pole-emploi.fr/offres/recherche/detail/4421688,2024-04-03,"Offre d'emploi Big Data Engineer - Lille, France (H/F) / Astek. - 59 - LILLE - 4421688 | France Travail",59 - LILLE,"Ce que nous allons accomplir ensemble : Nous rejoindre en tant que Big Data Engineer (H/F), afin d'accompagner un opérateur télécoms, Leader en Europe dans la création d'une infrastructure cloud (IAAS) performante, robuste et sécurisée. Un challenge portant sur des millions d'utilisateurs dans un environnement technique innovant, stratégique et où l'entraide et la bonne humeur priment !Votre mission, si vous l'acceptez : Qualifier les données et les résultatsConception technique des solutionsDécliner les impacts de la stratégie et des innovations technologiques au sein des processus et outils de l'exploitant SIAssurer l'accompagnement et le déploiement des évolutions des processus et outilsContribuer aux programmes de transformation DevOps, Cloud et catalogues des offres SIDévelopper des fonctions transverses et les « uses cases »Accompagner la phase de mise en production Votre future équipe : Vous intégrerez une équipe à la fois technique et fonctionnel, qui œuvre chaque jour pour développer et maintenir en conditions opérationnelles l'ensemble des solutions IT !L'équipe est en interaction avec des clients à la fois internes et externes.Votre stack de jeu Système d'exploitation : LinuxEnvironnement Big data : Hadoop, Spark, Scala Cloud computing : GCP ou AWS Base de données : No SQL (Cassandra, Mongo DB)Dataviz : Power BI ou KibanaDes notions en développement feront la différence ! Les petits plus du projet :Vous évoluerez au sein d'une équipe impliquée et réactive et interviendrez sur un projet polyvalent et à forte valeur ajoutée. Vous ? Diplômé(e) d'une école d'ingénieur ou équivalent de niveau Bac.Vous justifiez idéalement d'une expérience d'au moins 3 ans d'expériences sur un poste similaire ?Vous faite preuve de proactivité et d'esprit d'équipe, êtes doté(e) d'un excellent sens de l'organisation et vous aimez les challenges et la résolution de problème ? Alors ce poste est fait pour vous, n'hésitez plus et rejoignez l'aventure ASTEK !AstekCréé en France en , Astek est un acteur mondial de l'ingénierie et du conseil en technologies. Fort de son expertise dans de nombreux secteurs industriels et tertiaires, Astek accompagne ses clients internationaux dans le déploiement intelligent de leurs produits et de leurs services, et dans la mise en œuvre de leur transformation digitale.Depuis sa création, le Groupe a fondé son développement sur une forte culture d'entrepreneuriat et d'innovation, et sur l'accompagnement et la montée en compétence de ses collaborateurs qui s'engagent chaque jour à promouvoir la complémentarité entre les technologies numériques et l'ingénierie des systèmes complexes.","
Contrat à durée indéterminée

Contrat travail
",unspecified,unspecified,unspecified,Unspecified,Expérience exigée de 36 Mois,Contrat à durée indéterminée,False
