id,url,date,title,location,description,info,horaires,salairemin,salairemax,entreprise,experience,contrat,debutant
0150598,https://candidat.pole-emploi.fr/offres/recherche/detail/0150598,2024-01-23,Offre d'emploi Data Scientist / Data analyst (H/F) - 59 - WATTRELOS - 0150598 | Pôle emploi,59 - WATTRELOS,"Know Your People ? Vous connaissez ?
 Nous sommes une agence Conseil en Data Marketing dans la métropole Lilloise créée en 2014 par des passionnés de la connaissance clients, du marketing et de la performance.
 Nos métiers ? La prestation et la production d'analyses de données, le conseil en Data Marketing et le placement de ressources en entreprise chez nos propres clients (Régie).
 Nos forces ? Offrir à nos collaborateurs une expérience riche par la variété des missions et des technologies utilisées, leur permettre d'apprendre et de grandir avec nous et surtout un accompagnement de proximité (même en régie, vous êtes une journée par semaine à l'agence)
 L'entreprise se développe fortement et pour répondre à différentes demandes de nos clients, nous recherchons donc un expert dans l'exploitation pragmatique des Données CRM et Digital.
 Quelles seront vos missions ?
 Directement rattaché(e) à un Directeur de projets analytiques, vous serez amené(e) à :
 - Résoudre les problématiques de modélisation (scores d'appétence, modèles de survie, règles d'association produits)
 - Produire différentes analyses descriptives (segmentations, typologie, reportings, études ad hoc.), en mode régie ou en mode projet
 - Participer à des projets de R&D sur les nouvelles techniques analytiques et les nouveaux outils associés (IA, Big Data.).
 Le Profil que l'on cherche ?
 Ce poste en CDI à temps plein, basé à Villeneuve d'ascq (59) est fait pour vous si vous avez une formation en statistiques (type Master 2 ISN, SIAD, ENSAI, etc.), ou un diplôme avec une double compétence informatique et mathématiques, que vous maîtrisez les principales méthodes analytiques et les outils qui s'y rapportent (outils de data sciences du type R ou Python, outils de requêtage, et outils de data visualisation) et que vous manipulez merveilleusement bien la data dans un environnement du type SQL !
 Et tout cela avec une expérience d'au moins 5 ans sur un poste similaire en agence , dans le retail ou chez un pure player, avec une véritable appétence pour tout ce qui touche au marketing.
 Quant à votre personnalité, on dit de vous que vous êtes curieux(se), rigoureux(se), autonome, débrouillard(e) et Pro-actif(ve).
 Si vous répondre à ces critères, le poste est fait pour vous !
 Type d'emploi : Temps plein, CDIStatut : Cadre
 Salaire : 35 000,00€ à 50 000,00€ par an
 Avantages :
 * Prise en charge du transport quotidien
 * Travail à domicile occasionnel
 Programmation :
 * Du lundi au vendredi
 * Repos le week-end
 * Travail en journée
 Types de primes et de gratifications :
 * Prime annuelle
 * Prime trimestrielle
 Question(s) de présélection:
 * Combien d'années d'expérience en marketing ou dans le retail avez-vous ?
 Lieu du poste : Télétravail hybride (59650 Villeneuve-d'Ascq)","
Contrat à durée indéterminée

Contrat travail
",unspecified,unspecified,unspecified,Unspecified,Expérience exigée,Contrat à durée indéterminée,False
0139902,https://candidat.pole-emploi.fr/offres/recherche/detail/0139902,2024-01-30,Offre d'emploi Lead Data Scientist R&D H/F - 92 - SURESNES - 0139902 | Pôle emploi,92 - SURESNES,"POSTE : Lead Data Scientist R&D H/F
DESCRIPTION : www.servier.com
Le Groupe Servier mène une transformation digitale ambitieuse avec un objectif clair de devenir « best in class Digital Performer ». La Data Factory joue un rôle central dans cette ambition et a un impact fort à chaque étape de la chaine de valeur. Depuis la recherche de nouvelles molécules, la prédiction de leur comportement, l'analyse d'efficacité des traitements en passant par l'optimisation des processus de production des médicaments, la gestion des stocks et la prévision des ruptures jusqu'à l'approche omnicanale et personnalisée auprès des professionnels de santé, le suivi des patients : tous ces enjeux s'appuient sur la Data et sa puissance transformante.
Rattaché(e) à la Direction Digital, Data & IS, la Data Factory oeuvre pour rendre les données accessibles, les valoriser à travers des produits data métiers à base d'IA et d'Advanced Analytics, et transformer Servier en un groupe orientée data (« Data-driven ») où tous les collaborateurs connaissent les enjeux de la data.
La création des produits Data s'appuie sur une « plateforme Data» centrale, cloud-native, sécurisée et performante avec les technologies les plus avancées. Servier a établi un partenariat stratégique de cinq années avec Google Cloud, lui donnant accès à des technologies innovantes et des liens privilégiés avec Google Cloud, et permettant de disposer d'une puissance de calcul augmentée, d'accélérer l'analyse et de développer l'innovation sur de nombreux défis business et technologiques.
Au sein de la Data Factory, le pôle Data Science a pour mission d'accélérer la conception et déploiement des solutions de machine learning et intelligence artificielle. Cela se fait à travers le développement et partage des expertises en différents sujets IA (graphe, NLP, image, etc) et au développement des briques techniques transverses (« services ») dans la « plateforme data ».
Ce poste sera centré sur les projets de Recherche et Développement (R&D) qui ont pour objectif de pour identifier les gènes clés d'une maladie, optimiser le design d'une molécule, repérer les biomarqueurs de résistance ou de réponse à un médicament à partir de données variées telles que les données textuelles, les images médicales et les données génomiques.
Pour déployer ces solutions, nous développons des algorithmes de machine learning et deep learning autour des technologies de graphe sur des réseaux de gènes, de protéines et de médicaments pour mieux comprendre les relations complexes entre ces éléments et les maladies associées ; des modèles de NLP (Natural Language Processing) pour extraire des informations à partir de textes biomédicaux, tels que les publications scientifiques et les rapports cliniques; de l'analyse d'image médicales comme le IRM, les biopsies, entre autres.
Le poste est basé à notre siège à Suresnes et des déplacements au centre de Recherche et Développement à Saclay sont à prévoir.
Vos missions :
vous êtes impliqué(e) dans l'engagement de l'équipe au quotidien et faites tout pour l'aider pour délivrer des fonctionnalités en continue
vous travaillez en étroite relation avec les autres membres de la feature team pour aider à la création des algorithmes nécessaires pour les cas d'usages développés pour les équipes métier
vous échangerez de manière continue avec les métiers car nous pensons que la proximité avec le métier est la clef pour toucher le bon besoin business
vous mettez en place les nouveaux flux d'entrée et de sortie au sein de la plateforme data, et irez jusqu'au modeling et à l'activation de la donnée
vous assurez le delivery, et êtes constamment en veille sur les nouvelles technos.
Votre formation :
De formation supérieure en école d'ingénieur/université niveau Bac +5 (PhD est un plus), vous possédez au minimum 6 ans d'expérience professionnelle en tant que Data Scientist.
Vos compétences :
TECHNIQUES
- Vous maitrisez le développement en Python, et SQL ainsi que les méthodes et librairies de machine learning
- Vous avez la capacité à lire et comprendre des articles scientifiques sur le machine learning et de les appliquer aux données biologiques
- Vous avez des excellentes compétences en communication et en collaboration pour participer à la validation des résultats des modèles et des analyses avec l'équipe R&D
- Vous pensez que le notebook Jupyter n'est pas une fin en soi et la scalabilité de votre algorithme est un prérequis pour son activation,
- Vous avez la capacité à maintenir la chaîne Big Data, de la récupération de la donnée jusqu'à son exploitation finale, dans une approche CI/CD, avec des technos tel que docker,
- Vous avez une connaissance des données biologiques (génomique, imagerie médicale, donné","
Contrat à durée indéterminée

Contrat travail
",unspecified,unspecified,unspecified,Unspecified,Expérience exigée,Contrat à durée indéterminée,False
0147512,https://candidat.pole-emploi.fr/offres/recherche/detail/0147512,2024-01-23,Offre d'emploi Chef projet Data F/H - Techna France Nutrition (H/F) - 44 - COUERON - 0147512 | Pôle emploi,44 - COUERON,"Vous rejoignez une équipe composée de 7 personnes : un Responsable SI, un Architecte système et réseau, un Technicien de support informatique, 3 Chefs de projets informatiques et un Chargé de développement et support logiciels. Sous la responsabilité du Responsable systèmes d'information vous avez pour mission d'accompagner l'entreprise dans sa stratégie Data. A ce titre, vous conduirez des projets Data de leur conception jusqu'à leur déploiement en vous appuyant sur des compétences internes ou externes. 
 Vos principales missions sont les suivantes : 
  Définir, mettre en œuvre et conduire les projets  Structurer, construire et animer la gestion de la Data dans l'entreprise Veiller à la bonne organisation des Datas et des référentiels dans les systèmes d'information. Assurer une mission de conception et de développement (architecture logicielle, cartographie de flux, spécifications, exploitation des données via ETL, structuration et documentation des bases de données). Proposer des actions préventives afin d'améliorer le fonctionnement optimal des solutions mises en œuvre et assurer des actions de maintenance corrective. 
De formation BAC+5 en Informatique et Data, vous justifiez d'une expérience de 3 ans minimum sur un poste similaire.
 Vous avez une bonne maîtrise de l'écosystème BI et de ses outils : ETL (Semarchy), dataviz (Power BI). 
 Votre esprit d'équipe, votre sens de l'organisation, votre méthodologie et votre esprit d'initiative sont vos forces dans la gestion de projet.
 Votre aisance relationnelle, votre pédagogie et votre sens du service vous permettent d'échanger avec tous les métiers afin de comprendre leurs besoins et leur proposer les meilleures solutions. 
  
  
  Pourquoi rejoindre Techna ?    Nous vous offrons les moyens de vous épanouir professionnellement au sein de notre structure par : 
  Un package de rémunération : salaire fixe + rémunérations variables 45 jours de télétravail par année complète travaillée, 9 jours de RTT par année complète travaillée, Des titres restaurants d'un montant de 9€ par jour travaillé, pris en charge à 60% par l'entreprise, Une prime d'intéressement et participation, Une mutuelle d'entreprise familiale avec un taux de reste à charge inférieur à 10% et prise en charge à 70% par l'entreprise Une vie d'entreprise : sport, évènements conviviaux notamment via un CSE dynamique, Un parcours d'intégration prenant en compte les dimensions : Groupe - entreprise - équipe et poste de travail, La possibilité de devenir actionnaire d'un groupe indépendant. 
 
 
  Processus de recrutement    Le service recrutement prendra contact avec vous pour un premier échange téléphonique ou visio. 
 Lors d'un deuxième entretien cette fois-ci, en physique, vous rencontrerez le Responsable Systèmes d'Information, accompagné d'un représentant du service RH.","
Contrat à durée indéterminée

Contrat travail
",unspecified,unspecified,unspecified,Techna france nutrition,Expérience exigée de 3 An(s),Contrat à durée indéterminée,False
168CLYG,https://candidat.pole-emploi.fr/offres/recherche/detail/168CLYG,2024-01-22,Offre d'emploi Data scientist - 85 - BELLEVIGNY - 168CLYG | Pôle emploi,85 - BELLEVIGNY,"Et si vous nous apportiez votre savoir-faire pour développer et déployer des solutions innovantes en data science, IA et en ingénierie de donnés ?

Groupe Dubreuil Services, basé au siège social du groupe, compte près de 160 collaborateurs assurant un rôle de conseil et d'expertise (finance, droit, informatique, RH, marketing, etc ) auprès de l'ensemble des filiales du Groupe.
 
Le saviez-vous ? Au sein de Groupe Dubreuil Services, vous intégrerez une entreprise où il fait bon travailler ! Et c'est grâce à l'ensemble de nos collaborateurs que nous sommes certifiés pour la première fois par le baromètre Great Place To Work, depuis septembre 2023.
 
Rejoignez notre service Marketing situé à Bellevigny en tant que Data Scientist (H/F) en CDI.  

Sous la responsabilité d'Etienne, Responsable Data Science, vous aurez pour missions d'assurer :

-	Le développement et optimisation de modèles. Concevoir, fine-tuner et déployer des modèles adaptés : ML, Deep Learning, séries chronologiques, computer-vision, embeddings, etc.
-	Le Gestion de pipelines de données : mettre en place et maintenir des pipelines de données robustes pour le traitement, l'enrichissement et la mise à disposition des données et des modèles d'IA.
-	Le développement d'outils et d'APIs : concevoir des API et des outils pour faciliter l'accès aux modèles d'IA et aux données, et soutenir les équipes métiers dans leur utilisation.
-	La participation active à la réflexion stratégique et à la résolution de problèmes complexes sur l'exploitation des données et la création des modèles et d'IA.

Vos missions vous amèneront à effectuer une veille continue sur les avancées technologiques et à participer à des projets de recherche et développement pour innover dans le domaine de la data science et de l'IA.
Vous intégrerez une équipe de deux data scientists et collaborerez également avec les équipes internes du groupe : SEO, SEA, projet, développement web, marketing, etc. 
Vous travaillerez avec les différents pôles d'activités du Groupe vous garantissant richesse et dynamisme sur les missions proposées.

Vous êtes fait pour le poste si vous :
-	Disposez d'une formation BAC+4/+5 de type master ou un diplôme d'ingénieur en data science, avec au moins deux ans d'expérience ;
-	Maîtrisez python, notamment pandas, avez de l'expérience en création de modèles d'IA et en développement d'API ;
-	Possédez des compétences avancées en SQL et avez déjà travaillé avec au moins une solution cloud, idéalement GCP ;
-	Avez une solide expérience de docker et git ;
-	Aspirez à travailler dans une équipe dynamique où l'innovation, l'autonomie et la collaboration sont valorisées ;
-	Êtes désireux de développer continuellement vos compétences dans un environnement riche et stimulant.

Pour ne rien vous cacher, chez GDS :
-	Nous disposons d'une rémunération composée d'un salaire fixe sur 13 mois, d'une prime variable sur objectifs équivalent à un mois de salaire  
-	Nous bénéficions également d'avantages connexes tels qu'une mutuelle pour vous et votre famille, un accord de participation pour partager les bénéfices de l'entreprise, un CSE
-	Nous bénéficions d'un accord de télétravail à 2 jours/semaine pour préserver votre équilibre vie pro/vie perso 
-	Nous disposons d'un cadre de travail attractif accès au restaurant d'entreprise, salle de sport  
-	Nous collaborons dans la bonne humeur, l'enthousiasme et l'envie de rendre service aux filiales 
-	Nous vous accompagnons dans votre nouveau poste à travers un parcours d'intégration 


Rejoignez le Groupe DUBREUIL, un groupe familial diversifié et riche de ses nombreux métiers.
Parce que les images parlent mieux que les mots, venez voir tout ce que nous sommes : https://www.youtube.com/watch?v=M_6PwkNucNw  .","
Contrat à durée indéterminée

Contrat travail
",35H Travail en journée,unspecified,unspecified,Groupe dubreuil,24 mois,Contrat à durée indéterminée,False
168CGJN,https://candidat.pole-emploi.fr/offres/recherche/detail/168CGJN,2024-01-30,Offre d'emploi Data scientist - 77 - CHESSY - 168CGJN | Pôle emploi,77 - CHESSY,"Maîtrise du développement en langage Python
Maîtrise du développement en langage Javascript
Expérience sur la collecte de donnée d'une application de gestion
Collecte de données du marché immobilier via l'API Casapulse.
Gestion et stockage des données collectées dans une base de données PostgreSQL.
Analyse et traitement des données pour évaluer les tendances du marché immobilier.
Développement de modèles statistiques et de machine learning pour la prédiction des loyers.
Création d'une API et d'une interface utilisateur pour la visualisation des données et des résultats
du modèle.
(Seaborn, Scikit-learn, Jupyter Notebook, Flask, HTML/CSS, JavaScript, XGBOOT)

Construction d'un data Lake mixte autour de Hive
Modélisation de la catégorisation des produits
Catégorisation des produits selon les modèles de clustering
Entraînement de modèles de classification pour la recommandation
(Hive - Oracle- MongoDB - HDFS, Spark, Scikit-Learn, FastAPI - MLflow, Regression )","
Contrat à durée indéterminée

Contrat travail
",35H Travail en journée,32000.0,42000.0,Unspecified,6 mois,Contrat à durée indéterminée,False
0128584,https://candidat.pole-emploi.fr/offres/recherche/detail/0128584,2024-01-22,Offre d'emploi Data scientist (H/F) - 92 - MALAKOFF - 0128584 | Pôle emploi,92 - MALAKOFF,"Mission freelance 6 mois renouvelable. 
Localisation : Malakoff (IDF) 
Nous recherchons 4 freelances
TJM à définir
TT ⅔ jours par semaine
Missions
L'ingénieur IA sera responsable de la mise en place et de la maintenance d'une plateforme d'intelligence artificielle basée sur les technologies Azure Open AI et AWS. Il/elle est également responsable de la sécurité de la plateforme et de son évolutivité.
Principales responsabilités
- Mise en place d'une landing zone Azure et AWS pour l'IA
- Administration et sécurité des plateformes Azure et AWS
- Développement de cas d'usage d'IA avec les équipes DevOps
- Développement de l'IA generative
- Accompagnement des sociétés dans la définition et la mise en œuvre de leurs use cases
Compétences
- Au moins 5 ans d'expérience
- Connaissances approfondies des technologies Azure Open AI et AWS IA
- Connaissances en sécurité informatique
- Expérience en développement d'IA génerative
- Capacités de communication et de collaboration","
Contrat à durée indéterminée

Contrat travail
",unspecified,unspecified,unspecified,Unspecified,Expérience exigée,Contrat à durée indéterminée,False
0124441,https://candidat.pole-emploi.fr/offres/recherche/detail/0124441,2024-01-22,"Offre d'emploi Ingénieur Data Scientist F/H - Système, réseaux, données (H/F) - 91 - LARDY - 0124441 | Pôle emploi",91 - LARDY,"Descriptif du poste:

Dans le cadre du développement de notre activité dans le secteur automobile, nous recherchons un Ingénieur Data Scientist dont la mission est d'analyser et d'exploiter toutes les datas des clients, des prospects ou bien encore des employés que l'entreprise récupère via différents canaux.
* Il a une vision plus globale, sur ce, il se charge de traduire les problèmes business en problèmes mathématiques et statistiques, afin de fournir des rapports permettant d'orienter les prises de décision du management et d'améliorer les performances et les stratégies marketing.
* L'objectif est de créer des modèles prédictifs et d'aider la prise de décision par la construction d'algorithmes.
* Les missions du Data Scientist sont variées :
* Identification des outils d'analyse ;
* Définition de solutions de stockage des données ;
* Recueil et analyse des données pertinentes pour l'entreprise ;
* Construction d'algorithmes permettant d'améliorer les résultats de recherches et de ciblage ;
* Élaboration de modèles de prédictions afin d'anticiper les évolutions des données et des tendances ;
* Création de tableaux de bord adaptés afin de rendre les résultats lisibles et exploitables par tous les métiers ;
* Veille technologique (collecte de données, plateformes de traitement, expérimentation).
Il est souvent amené à interagir avec les équipes métiers tels que le marketing, la finance ou bien encore les commerciaux

Profil recherché:

De formation BAC +5 ou Ingénieur de formation Data Science, informatique industrielle ou de statistique, vous avez au moins 2 années d'expériences sur un poste similaire dans le secteur automobile. 
Connaissances souhaitées :  Véhicule électrique, GMPe, 
Vous avez des compétences avancées en techniques d'analyse des données, en méthodologies statistiques et maitrisez les outils de Data visualisation /programmation informatique : Python (incontournable), Google platform, Matlab, Excel
Votre bon relationnel client, votre réactivité et votre force de proposition vous permettront de mener à bien ce projet.
La maîtrise de l'anglais est impérative
Informations complémentaires
SEGULA TECHNOLOGIES est une entreprise attachée à la mixité et à la diversité, nous reconnaissons et recrutons tous les talents.","
Contrat à durée indéterminée

Contrat travail
",unspecified,unspecified,unspecified,Segula technologies,Expérience exigée de 2 An(s),Contrat à durée indéterminée,False
0123502,https://candidat.pole-emploi.fr/offres/recherche/detail/0123502,2024-01-22,"Offre d'emploi Tech Lead / Data Scientist senior F/H - Système, réseaux, données (H/F) - 33 - TALENCE - 0123502 | Pôle emploi",33 - TALENCE,"Descriptif du poste:

Dans le cadre de l'un de ses projets de paris sportifs automatisés, sense4data recherche un/une Tech Lead Data Scientist pour compléter son équipe en pleine expansion. Nos projets explorent l'univers du sport, des statistiques, de la prédiction et de la technologie afin de placer les paris les plus optimisés pour le football, le tennis, le basket et plus encore.
Missions :
*     Manager et coordonner une équipe de data scientists.
* Assurer la qualité et l'efficience du code de data science.
* Instaurer et faire respecter les bonnes pratiques et procédures data science.
* Coordonner avec les équipes de data engineering pour une bonne mise en production des modèles ML.
* Faire de la veille technologique sur les avancées en machine learning.
* Récupération de données à partir de diverses sources et assurance de leur qualité.
* Réflexion et implémentation de nouvelles features métier.
* Modélisation et mise en œuvre de stratégies de paris automatisées.
* Inspection, suivi et amélioration des métriques de performance clés de nos stratégies.

Profil recherché:

* Au moins 3 ans d'expérience en tant que data scientist.
* Diplôme d'ingénieur en informatique, data science ou équivalent.
* Connaissance approfondie du Machine Learning et de la théorie de divers modèles.
* Solides compétences en algorithmique, DevOps et MLOps.
* Excellentes capacités de communication et de gestion d'équipe.
* Forte appétence et expertise pour au moins un des sports: football, tennis, basketball.
* Maîtrise des outils de programmation et d'analyse de données tels que Python, Pandas, Numpy, Git et SQL
* Capacité à communiquer efficacement en français et en anglais, à la fois à l'écrit et à l'oral","
Contrat à durée indéterminée

Contrat travail
",unspecified,unspecified,unspecified,Sense4data,Expérience exigée de 3 An(s),Contrat à durée indéterminée,False
