id,url,date,title,location,description,info,horaires,salairemin,salairemax,entreprise,experience,contrat,debutant
7950646,https://candidat.pole-emploi.fr/offres/recherche/detail/7950646,2025-06-08,Offre d'emploi Alternance Data Analyst F/H (H/F) - 78 - GUYANCOURT - 7950646 | France Travail,78 - GUYANCOURT,"Vous intégrerez la DSI BSCC, et plus particulièrement, la direction Data&IA. Au sein de cette direction, vous travaillerez en proximité avec tous les métiers (Courrier, Colis et Nouveaux Services) de la branche
Toutes ses Business Unit sont moteurs dans la mise en place de nouvelles offres...et nous les accompagnons sur la qualification des process, sur la qualité de service...
En tant qu'alternant.e Data Analyst, vous contribuerez à l'analyse et à la valorisation des données au service des équipes métiers. Vos principales missions :
-        Collecter, exploiter et interpréter les données du périmètre
-        Concevoir et réaliser des tableaux de bord (Excel, Power BI.) utiles à la bonne compréhension du périmètre et au pilotage
-        Fournir des rapports clairs et lisibles, via des outils Power BI, Excel, Power Point à destination des différents interlocuteurs
-        DataViz, être capable de transformer des données brutes en représentations graphiques
-        Bonne connaissance DSS (Dataiku), Power BI, Tableau
-        Travail en équipe
-        Ouverture
-        Capacité de synthèse
Si vous êtes passionné(e) par la Data et l'Intelligence Artificielle, l'École de la Data & IA du Groupe La Poste vous offre une opportunité unique. Elle recrute des alternants en contrat d'apprentissage pour suivre le cursus « Data Analyst » de niveau 6 avec notre partenaire pédagogique OpenClassrooms.
Un programme certifié par l'État, conçu pour former les experts de demain en gestion et analyse des données. Diplômé.e d'un Bac+2 dans un domaine développement informatique, les études statistiques ou commerciales, le marketing analytique ou en gestion financière.
Les candidat(e)s retenu(e)s seront ensuite convié(e)s à des entretiens en présentiel organisés par La Poste, le 19 juin 2025 à Paris. Cet évènement sera l'occasion pour les managers de rencontrer les candidat(e)s et de confirmer les recrutements.","
Contrat à durée déterminée - 6 Mois

Contrat apprentissage
",unspecified,unspecified,unspecified,781630-guyancourt doric dcnsi,Expérience souhaitée de 1 An(s),Contrat à durée déterminée - 6 Mois,False
7950552,https://candidat.pole-emploi.fr/offres/recherche/detail/7950552,2025-06-08,Offre d'emploi Alternance Data Analyst F/H (H/F) - 45 - ORLEANS - 7950552 | France Travail,45 - ORLEANS,"Contexte
Au sein de l'Université-Services-Courrier-Colis, organisme interne de formation composé de 140 personnes, le Pôle Solutions et Services est une équipe de 3 qui met à disposition des filières RH et opérationnelle, les données nécessaires au pilotage de la formation des 100 000 postiers de la Branche Services-Courrier-Colis.
Ces données sont nombreuses sur le périmètre RH et formation. Elles font l'objet de traitements et d'analyses en statique ou en projection pour permettre à la branche d'atteindre ses objectifs stratégiques et aux acteurs du terrain de suivre et piloter les actions nécessaires au maintien et au développement des compétences de leurs agents.
L'enjeu est autant la publication des chiffres que la mise à disposition de support attractif plus ou moins complexes qui seront au service de l'action.
Votre mission
En tant qu'alternant Data Analyst, vous contribuerez à l'analyse et à la valorisation des données à destination des commanditaires de formation et au service des équipes RH et métiers sur tout le territoire national. Vos principales missions :
Mettre en place des outils de pilotage et de reporting à partir des données RH et de formation.  
Analyser et fiabiliser les données de formations au service : 
- de l'organisation et de la promotion du catalogue de formation, 
- de la gestion des inscriptions, 
- de l'enregistrement du réalisé...
Automatiser les traitements liés à la présentation et à la diffusion des informations
Traitement des données (SQL, langage de programmation)  
Data visualisation (PowerBI, Tableau...)
IA
Ecoute client
Coopération
Agilité et adaptation 
Prise d'initiative et force de proposition. Diplôme Bac+2 dans un domaine développement informatique, les études statistiques ou commerciales, le marketing analytique ou en gestion financière.","
Contrat à durée déterminée - 6 Mois

Contrat apprentissage
",unspecified,unspecified,unspecified,750364-paris drh mutualisee des sieges,Expérience souhaitée de 1 An(s),Contrat à durée déterminée - 6 Mois,False
7941336,https://candidat.pole-emploi.fr/offres/recherche/detail/7941336,2025-06-10,Offre d'emploi Data scientist (H/F) - 06 - NICE - 7941336 | France Travail,06 - NICE,"En tant qu&#039;organisateur de forums de recrutement, Talents Handicap accompagne de très nombreuses entreprises &amp; organisations en France dans leurs recrutements de collaborateurs en situation de handicap. Participant actuellement à l&#039;un de nos forums. L'entreprise Apside recherche actuellement des profils :  ? Découvrez la Vie Apsidienne ? et vous aussi, devenez Apsidienstrong>On aurait pu demander à Chat GPT de vous démontrer en quoi Apside est l'ESN qu'il vous faut, mais on préfère que vous le découvriez vous-mêmes ?? ? Découvrez votre future missionstrong>¿? Contexte¿Collaborateur(rice) Apsidien(ne) de l'agence de Sophia-Antipolis, vous accompagnez l'un de nos clients en tant que Data Scientist (F/H).? Mission¿Intégré(e) au sein d'une équipe Agile, vous accompagnerez différents métiers portant les projets afin de s'assurer de la pertinence de la modélisation et de la cohérence des résultats.Cadrage des sujets,Préparation des bases de données, engineering des features,Ecritures et tuning des modèles de ML,Préparation à l'industrialisation sous forme de projets? Localisation¿Technopôle de Sophia-AntipolisTélétravail hybride? Le package salarial que nous vous proposons //¿Contrat¿: CDIRémunération¿: selon profil(D'abord on échange, on comprend vos compétences/aspirations professionnelles et ensuite on s'entend sur le salairep>Avantages groupe¿: carte ticket restaurant Swile, prime de mobilité, RTT, accord télétravail, Mutuelle, prime de cooptation.Formation¿: certifications techniques, cours particuliers d'anglais en interne, accès à un catalogue de formations grâce à notre plateforme en e-learning (Academy by Apside) ou via nos organismes partenairesp>","
Contrat à durée indéterminée

Contrat travail
",unspecified,unspecified,unspecified,Unspecified,Débutant accepté,Contrat à durée indéterminée,True
7939066,https://candidat.pole-emploi.fr/offres/recherche/detail/7939066,2025-06-07,Offre d'emploi Data Scientist - Consultant en Optimisation de Systèmes d'Information Bancaire (H/F) - 44 - NANTES - 7939066 | France Travail,44 - NANTES,"En tant qu&#039;organisateur de forums de recrutement, Talents Handicap accompagne de très nombreuses entreprises &amp; organisations en France dans leurs recrutements de collaborateurs en situation de handicap. Participant actuellement à l&#039;un de nos forums. L'entreprise Inetum recherche actuellement des profils :  Description de l'entrepriseInetum est un leader européen des services numériques. Pour les entreprises, les acteurs publics et la société dans son ensemble, les  consultants et spécialistes du groupe visent chaque jour l'impact digital : des solutions qui contribuent à la performance, à l'innovation et au bien commun.Présent dans 19 pays au plus près des territoires, et avec ses grands partenaires éditeurs de logiciels, Inetum répond aux enjeux de la transformation digitale avec proximité et flexibilité.Porté par son ambition de croissance et d'industrialisation, Inetum a généré en  un chiffre d'affaires de 2,5 milliards dp>Pour répondre à un marché en croissance continue depuis plus de 30ans, Inetum a fait le choix délibéré de se recentrer sur 4 métiers afin de gagner en puissance et proposer des solutions sur mesure, adaptées aux besoins spécifiques de ses clients : le conseil (Inetum Consulting), la gestion des infrastructures et applications à façon (Inetum Technologies), l'implémentation de progiciels (Inetum Solutions) et sa propre activité d'éditeur de logiciels (Inetum Software). Inetum a conclu des partenariats stratégiques avec 4 grands éditeurs mondiaux - Salesforce, ServiceNow, Microsoft et SAP et poursuit une stratégie d'acquisitions dédiée afin d'entrer dans le top 5 européen sur ces technologies et proposer la meilleure expertise à ses clients.Tous nos postes sont ouverts aux personnes en situation de handicap.Description du posteNous recherchons un consultant expérimenté pour intervenir chez un client majeur dans le secteur bancaire. Vous serez chargé d'analyser et d'optimiser le système d'information général, en vous concentrant sur l'ensemble des applications utilisateurs et clients.Contexte :
La solution RAG connectée à la base KM est actuellement en place. Il est crucial de mesurer la qualité des réponses générées et d'identifier les leviers d'optimisation pour une meilleure pertinence.Objectif de la mission :
Analyser la performance de la chaîne RAG et proposer des axes d'amélioration pour accroître la pertinence, la complétude et la cohérence des réponses.QualificationsActivités principales :Définir un protocole d'évaluation de la qualité des réponses (metrics, cas d'usage).Effectuer des tests sur différentes stratégies de chunking et embeddings.Analyser l'impact des filtres par métadonnées sur la pertinence.Proposer des ajustements sur le retrieval (top-k, regroupement de chunks).Tester différents prompts ou templates d'appel LLM.Mettre en place un tableau de bord de suivi de performance.Proposer des stratégies de reranking ou scoring avancé.Documenter les tests et les recommandations d'amélioration.Profil recherché :Expérience significative dans l'analyse et l'optimisation de systèmes d'information, idéalement dans le secteur bancaire.Compétences en gestion de bases de données et en intelligence artificielle.Capacité à travailler de manière autonome et à proposer des solutions innovantes.Excellentes compétences en communication et en documentation.Informations supplémentairesPourquoi nous rejoindre ?
Vous aurez l'opportunité de travailler sur des projets stratégiques au sein d'une institution bancaire de premier plan, en contribuant directement à l'amélioration de la qualité des services offerts aux utilisateurs et clients.Si vous êtes passionné par le développement mobile et souhaitez relever ce défi, nous vous invitons à postuler dès maintenant.Nous sommes impatients de découvrir votre candidature et de vous rencontrer pour discuter de cette opportunité.Notre processus de recrutement est conçu pour être transparent et équitable pour tous les candidats. Il comprend généralement une première étape de sélection de CV, suivie d'un entretien téléphonique avec un recruteur. Les candidats retenus seront ensuite invités à un entretien avec le responsable du poste.","
Contrat à durée indéterminée

Contrat travail
",unspecified,unspecified,unspecified,Unspecified,Débutant accepté,Contrat à durée indéterminée,True
7931883,https://candidat.pole-emploi.fr/offres/recherche/detail/7931883,2025-06-07,Offre d'emploi Data Scientist/IA (H/F) - 69 - 7931883 | France Travail,69,"Le poste

Mission :

En tant que Data Scientist (H/F), vous serez en charge des missions suivantes :","
Contrat à durée indéterminée

Contrat travail
",unspecified,unspecified,unspecified,Unspecified,Débutant accepté,Contrat à durée indéterminée,True
7928785,https://candidat.pole-emploi.fr/offres/recherche/detail/7928785,2025-06-07,Offre d'emploi Data scientist (H/F) - 86 - POITIERS - 7928785 | France Travail,86 - POITIERS,"Je recrute pour l'un de mes clients à Poitiers un Lead Data Scientist F/H.

En tant que Lead Data Scientist, vous serez rattaché(e) au Directeur Data &amp; Innovation et aurez la responsabilité de créer, piloter et industrialiser les projets IA du groupe. Vous aurez également l'opportunité de structurer une nouvelle équipe Data Science avec une forte autonomie sur les choix techniques et les priorités stratégiques. Vos missions.
 - Concevoir et développer des modèles de Machine Learning pour répondre à des problématiques métiers telles que la prévision des ventes, le scoring crédit, la détection de churn, l'optimisation des stocks et la valorisation des actifs.
 - Industrialiser les modèles en collaboration avec le Data Engineering, en suivant les meilleures pratiques MLOps (monitoring, déploiement continu, scalabilité). Stack envisagée : Python, SQL, MLflow, Docker, Snowflake, Airflow, Sifflet, Power BI (et ouverte à vos propositions).
 - Recruter, encadrer et faire monter en compétence 2 à 3 Data Scientists dans un premier temps.
 - Assurer la qualité des livrables et l'intégration des solutions dans les processus opérationnels métiers.
 - Définir la vision, les standards méthodologiques et les bonnes pratiques du pôle.
 - Travailler en synergie avec les équipes Data Engineering, Analytics, Data Quality, ainsi qu'avec les directions métiers (Marketing, Retail, Finance, RH).
 - Cadrer les projets en autonomie avec les métiers et transformer leurs besoins en solutions concrètes.
 - Assurer une veille continue sur les innovations IA, MLOps et Data Science.
 Si vous avez ces compétences ! Vous êtes le profil recherché, n'hésitez pas à candidater ! 
 - Diplôme Bac+5 / Doctorat en mathématiques appliquées, statistiques, machine learning ou équivalent.
 - Expérience confirmée en Data Science, en particulier sur la conception, le déploiement et l'industrialisation de modèles IA.
 - Solide maîtrise des outils : Python, SQL, bibliothèques ML classiques (scikit-learn, TensorFlow, XGBoost...), environnements Cloud ou Data Warehousing.
 - Pratique du MLOps et du déploiement de modèles en production
Ce que vous obtiendrez :
 - Un environnement de travail stimulant et collaboratif.
 - Un rôle clé : Construire et piloter de zéro un pôle Data Science stratégique.
 - Des moyens ambitieux : Stack moderne et évolutive, support direct du top management.
 - Des projets IA opérationnels : Des cas d'usage concrets qui impactent directement le business.
 - Un environnement dynamique : Ambiance agile, équipe en pleine construction, perspectives d'évolution rapides.
N'attendez plus! Candidatez.

Dans le cadre de sa politique diversité, Manpower étudie, à compétences égales, toutes candidatures dont celles de personnes en situation de handicap","
Contrat à durée indéterminée

Contrat travail
",unspecified,unspecified,unspecified,Unspecified,Expérience exigée de 5 An(s),Contrat à durée indéterminée,False
7920408,https://candidat.pole-emploi.fr/offres/recherche/detail/7920408,2025-06-07,Offre d'emploi Data scientist (H/F) - 75 - PARIS 01 - 7920408 | France Travail,75 - PARIS 01,"Pour un client grand compte de l'assurance, nous recherchons un Data Scientist. Vous interviendrez dans l'équipe Data Science et Intelligence Artificielle. 
Celle-ci a pour mission en 2025 de déployer une ""plateforme de services IA Générative"" composée de plusieurs services IA à développer, s'inscrivant dans des process afin de répondre à des uses-cases métiers. Les services prioritaires à déployer sur 2025 sont le service NLU (Natural Language Understanding), le service OCR (Optical Character Recognition) ou encore KM (Knowledge Management). 
La mission consistera au déploiement du service KM dédié aux apporteurs, à la contribution des autres services IA ainsi que des missions d'expérimentation au sein du ""Lab Techno"" aux côtés des autres Data Scientists, et des représentants de la direction de l'Innovation.","
Profession libérale

Emploi non salarié
",unspecified,unspecified,unspecified,Cat-amania,Expérience exigée de 2 An(s),Profession libérale,False
7920064,https://candidat.pole-emploi.fr/offres/recherche/detail/7920064,2025-06-07,Offre d'emploi Data scientist (H/F) - 75 - PARIS 01 - 7920064 | France Travail,75 - PARIS 01,"Nous recherchons un(e) Data Scientist expérimenté(e) pour rejoindre notre équipe tournée vers l?avenir. Dans ce rôle, vous exploiterez des techniques de pointe en apprentissage automatique, modélisation statistique et apprentissage profond pour relever des défis commerciaux complexes. Vous jouerez un rôle clé dans la conception et l?architecture de nos solutions, en garantissant des résultats de haute qualité et en maintenant une base de code robuste.
Développer, tester et déployer des modèles d?apprentissage automatique de bout en bout, avec un accent particulier sur l?apprentissage multimodal et les modèles Vision-Langage (VLMs)
Stimuler l?innovation en explorant de nouvelles architectures de modèles, en appliquant l?apprentissage par transfert et en optimisant les performances
Collaborer avec les ingénieurs pour mettre en ?uvre de bonnes pratiques MLOps, incluant le versionnage des modèles, le suivi des expériences et le déploiement automatisé
Mettre en place et maintenir des systèmes d?observabilité pour les LLMs, surveiller les performances, détecter les biais et analyser les dérives
Réaliser des tests A/B et des évaluations statistiques pour valider les améliorations des modèles
Construire et optimiser les pipelines de données et les workflows d?ingénierie des caractéristiques en partenariat avec les ingénieurs ML
Participer à des conférences internationales et y représenter l?entreprise, en partageant des idées et des retours d?expérience
Contribuer à la documentation interne et externe, y compris des articles, présentations et billets de blog
Votre ProfilPlus de 6 ans d?expérience en science des données, avec une forte spécialisation en apprentissage profond et traitement du langage naturel ; une expérience en vision par ordinateur est un plus
Maîtrise avancée de Python, avec une expérience pratique de PyTorch ou TensorFlow
Capacité avérée à concevoir, entraîner et déployer des modèles ML complexes dans des environnements multimodaux
Solide base en analyse statistique et conception expérimentale
Maîtrise de la manipulation de données avec SQL, Spark et pandas
Expérience avec les infrastructures ML basées sur le cloud (ex. : AWS)
Bonne compréhension des principes MLOps et des workflows CI/CD pour le ML
Atouts SupplémentairesExpérience avec TensorBoard pour la visualisation et le débogage des modèles
Connaissance des outils de suivi des LLMs comme MLflow, LangFuse ou LangSmith
Connaissance de LangChain ou de frameworks similaires pour les applications LLM
Expérience en entraînement distribué pour les modèles à grande échelle
Stack TechniqueLangages : Python (avancé), SQL
Frameworks : PyTorch ou TensorFlow, Hugging Face Transformers
Outils de données : Spark, pandas, NumPy
MLOps : MLflow, Kubeflow (ou équivalent)
Visualisation : Matplotlib, Seaborn, Plotly
Contrôle de version : Git, DVC
Cloud : AWS
Conteneurisation : Docker, Kubernetes","
Profession libérale

Emploi non salarié
",unspecified,unspecified,unspecified,Phaidon london- glocomms,Expérience exigée de 5 An(s),Profession libérale,False
7917457,https://candidat.pole-emploi.fr/offres/recherche/detail/7917457,2025-06-07,Offre d'emploi Alternance - Data Scientist (H/F) - 75 - PARIS 01 - 7917457 | France Travail,75 - PARIS 01,"En tant qu'organisateur de forums de recrutement, Talents Handicap accompagne de très nombreuses entreprises & organisations en France dans leurs recrutements de collaborateurs en situation de handicap. Participant actuellement à l'un de nos forums.L'entreprise Hermès recherche actuellement des profils : 

 

 Missions principales

 * Accélérer la montée en puissance de la Data Science pour le Retail 

 * Reprendre et améliorer les sujets IA existants au sein de l'équipe
 * Développer de nouveaux algorithmes de Machine Learning à destination de la relation client et du Retail
 * Promouvoir et animer l'utilisation de l'Intelligence Artificielle pour le retail en recensant et valorisant les cas d'usages de l'IA

 

 * Monitorer la performance commerciale 

 * Assister l'équipe Retail Data dans la réalisation des études AD HOC à destination des entités de production et de nos filiales de distribution
 * Accompagner les Data Analysts dans la création de nouveaux reportings et leurs améliorations à destination des filiales de distribution et entités de production

 

 * Assurer une veille qualitative des innovations Data Science appliquées au Retail 

 * Recenser et centraliser les nouvelles méthodologies d'algorithmie applicables à l'univers du Retail
 * Mettre à disposition cette veille aux membres de l'équipe
Profil souhaité

 * Etudiant(e) en Bac +4/5 en grande école ou grande université, en spécialité Statistiques/Data Science
 * Connaissance des bases de données et à l'aise avec les langages de programmation (SQL, Python, etc.)
 * La connaissance de l'environnement AWS et ses composants (Sagemaker, etc.) est un plus
 * La connaissance de PowerBI est un plus
 * Langues : Anglais courant (écrit et oral)
 * Capacité d'analyse et esprit de synthèse
 * Curiosité et faculté d'adaptation","
Contrat à durée déterminée - 12 Mois

Contrat apprentissage
",35 H  Travail en journée,unspecified,unspecified,New net 3d,Expérience souhaitée de 2 An(s),Contrat à durée déterminée - 12 Mois,False
7911754,https://candidat.pole-emploi.fr/offres/recherche/detail/7911754,2025-06-07,Offre d'emploi Data Scientist Maitrisant - Big Query/SQL/GITHUB/Optimisations BQ/GCP (H/F) - 59 - LILLE - 7911754 | France Travail,59 - LILLE,"ASFOTEC - Make IT Simple
Nous sommes une entreprise de services numériques Lilloise créée en 2017, à taille humaine et qui met l'humain au centre de sa préoccupation.
Grâce aux compétences et à l'expérience de notre équipe, nous accompagnons aujourd'hui nos clients grands comptes et PME de la région Lilloise dans leurs défis numériques et nous créons également nos propres solutions BtoB et BtoC dans notre pôle de Recherche et Développement.
Compétences techniques :
* BIG QUERY - Expert - Impératif
* SQL - Confirmé - Impératif
* Optimisations BQ - Confirmé - Impératif
* GOOGLE CLOUD - Confirmé - Important
Français Courant (Impératif)
Anglais Professionnel (Impératif)
Lien du test : https://candidate.evalil.com/test/671b7420d35be93152f7fe85
Profil recherché:
Nous recherchons un expert BIG QUERY pour mettre en place une gouvernance BQ et des bonnes pratiques d'usage et optimiser les projets existants avec les équipes de dev.
SA MISSION :
Intervenant auprès des Métiers, il exploite, analyse et évalue la richesse, de données structurées ou non, appartenant à l'entreprise ou non, pour établir des scénarios permettant de comprendre et d'anticiper de futurs levier Métiers ou opérationnels pour l'entreprise
SON ACTIVITE :
* Applique des techniques (statistiques, text mining, comportementale, géolocalisation, ) d'extraction et d'analyse d'informations, obtenues à partir de gisements de données (Big Data)
* Obtient des données adéquates, trouve les sources de données pertinentes, fait des recommandations sur les bases de données à consolider, modifier, rapatrier, externaliser, internaliser, conçoit des datamarts, voire des entrepôts de données (data warehouses).
* Évalue la qualité et la richesse des données, les analyse et en restitue les résultats pour ensuite les intégrer dans le système d'information cible du Métier.
* Analyse les données pour traduire une problématique Métier en problème mathématiques/statistiques et réciproquement.
* Compare et évalue différents modèles ou méthodes de calcul et anticipe les avantages et inconvénients dans un environnement Métier.
SES LIVRABLES :
* Scénarios prédictifs
Lieu : Lille Fr
Type d'emploi : Temps plein, CDI
Statut : Cadre
Avantages :
* Intéressement et participation
* Prise en charge du transport quotidien
* RTT
* Travail à domicile occasionnel
Horaires :
* Du lundi au vendredi
* Flextime
* Période de travail de 8 Heures
Rémunération supplémentaire :
* Heures supplémentaires majorées
* Primes
Lieu du poste : Télétravail hybride (Lille)
Date de début prévue : 07/06/2025","
Contrat à durée indéterminée

Contrat travail
",unspecified,unspecified,unspecified,Unspecified,Débutant accepté,Contrat à durée indéterminée,True
