id,url,date,title,location,description,info,horaires,salairemin,salairemax,entreprise,experience,contrat,debutant
0532618,https://candidat.pole-emploi.fr/offres/recherche/detail/0532618,2024-01-30,Offre d'emploi Data Scientist H/F - 63 - CLERMONT FERRAND - 0532618 | Pôle emploi,63 - CLERMONT FERRAND,"POSTE : Data Scientist H/F
DESCRIPTION : C'est pourquoi, dans le cadre du développement de nos activités et la mise en place de projets à fortes valeurs ajoutés, nous recrutons un Data Scientist H/F à Clermont-Ferrand. Dans ce cadre-là, vous serez amené(e) à mettre à profit vos compétences en analyse de données sur un projet évoluant dans un contexte international.

Vos principales missions seront :
-  Réaliser l'analyse de données pour en qualifier la qualité et la cohérence et leur intégration dans les services de l'entité
-  S'approprier des données disponibles actuellement
-  Développer et industrialiser des algorithmes de datascience
-  Maintenir en conditions de performances des modèles de datascience
-  Réaliser la documentation associée à chacune des réalisations
PROFIL : De formation Ingénieur/Bac +5, vous justifiez de 3 années d'expérience minimum sur un poste de Data scientist qui vous aura permis d'appréhender le milieu de la donnée.

Vous maitrisez les outils suivants :
Vous possédez de solides connaissances en statistiques, probabilités, traitement du signal ainsi qu'un solide esprit analytique.
Vous maîtrisez divers langages de programmation tels que Python, Spark, R-studio ainsi que l'utilisation de bases de données non structurées Mongo DB, Cassandra
Vous possédez une solide expérience avec les outils et composants Microsoft Azure tels que DataBricks ou PowerBI
Vous avez une bonne maîtrise des outils de configuration tels que Git

Vous êtes reconnu pour fédérer une équipe, bon communicant et curieux. Vous aimez travailler en équipe tout en sachant être organisé et autonome dans votre travail.
Le poste est à pouvoir immédiatement.

Nous sommes convaincus que de l'intelligence collective naît le succès. Il n'existe pas qu'un modèle, chez Akkodis nous valorisons l'agilité et l'excellence, l'audace et la créativité.
Et si nous parlions ensemble de vos ambitions pour les prochaines années ?

Akkodis accompagne ses clients dans la mondialisation de leurs projets, aussi un anglais courant est requis pour l'ensemble de nos collaborateurs.

Processus de recrutement :
· Un(e) chargé(e) de recrutement vous contacte pour échanger sur votre projet professionnel
· Vous échangez ensuite avec un(e) manager sur les aspects techniques et les projets

Akkodis est une entreprise handi-engagée et inclusive. Tous nos postes sont ouverts aux handicaps et à la diversité. Tous différents, tous compétents !
A bientôt pour vivre l'aventure AKKODIS !","
Contrat à durée indéterminée

Contrat travail
",unspecified,35000.0,50000.0,Unspecified,Expérience exigée,Contrat à durée indéterminée,False
0531891,https://candidat.pole-emploi.fr/offres/recherche/detail/0531891,2024-01-30,Offre d'emploi Data Scientist H/F - 75 - PARIS 01 - 0531891 | Pôle emploi,75 - PARIS 01,"POSTE : Data Scientist H/F
DESCRIPTION : En postulant à cette offre, vous aurez l'opportunité de rejoindre une entreprise qui a créé une solution technologique de vente à emporter virtuelle conçue pour donner au secteur de la restauration une forte impulsion en termes de revenus. Les restaurants bénéficient d'une activité de livraison de nourriture rationalisée qui s'intègre directement dans leurs cuisines existantes, les commandes provenant de toutes les principales plateformes de livraison étant envoyées via une tablette connectée.Votre mission si vous l'acceptez : 
Quelles seront mes tâches quotidiennes ? 
 
-  Collaborer avec une équipe de Data Scientists pour développer un moteur de tarification et de promotion piloté par ML, améliorant la rentabilité de Clone et de nos partenaires. 
 
-  Concevoir des modèles de prévision des ventes sophistiqués, exploiter les données pour prédire les tendances du marché et informer les décisions stratégiques, alimentant la croissance et l'efficacité opérationnelle de Clone. 
 
-  Développer des stratégies analytiques avancées pour maximiser les revenus et fournir des informations sur les performances de la marque alimentaire, en aidant à façonner les stratégies de marketing et de produits. 
 
-  Travailler en étroite collaboration avec les équipes d'ingénierie logicielle et de données pour développer une plateforme d'IA interne révolutionnaire, contribuant ainsi à l'avancée technologique de Clone.
Avantages
Il en faut plus pour vous convaincre ? 
 
-  Salaire très compétitif 
-  Options d'achat d'actions 
-  Un voyage vers la licorne 
-  Travaillez sur des projets de pointe et collaborez avec une équipe talentueuse. 
-  Un régime de travail hybride/à distance flexible 
-  Faire partie d'une culture d'entreprise dynamique et innovante 
-  Une chance de travailler au coeur de Paris ou de Barcelone 
-  D'autres avantages (soins de santé, salle de sport, etc.) 
 
Rejoignez-nous et faites partie d'une équipe innovante qui façonne l'avenir des marques alimentaires virtuelles. Si vous êtes passionné par les données, que vous vous épanouissez dans un environnement dynamique et que vous souhaitez avoir un impact significatif, nous serions ravis d'entendre parler de vous !
PROFIL : Et vous !
À quoi ressemblerait le candidat idéal ?

Qualifications de base :
-   Baccalauréat en informatique, statistiques, mathématiques ou dans un domaine connexe.
-   Minimum de 3 ans d'expérience dans un rôle de Data Scientist.
-   Maîtrise des techniques de modélisation statistique.
-   Solide compréhension et application des modèles courants d'apprentissage automatique.
-   Expérience avérée dans la mise en oeuvre de modèles d'apprentissage automatique dans un environnement de production.
-   Compétences avancées en Python et SQL.

Qualifications préférées :
-   Expérience dans le domaine de l'analyse de la vente au détail.
-   Implication dans des projets liés à la tarification.
-   Familiarité avec les réseaux neuronaux et les concepts d'IA générative.","
Contrat à durée indéterminée

Contrat travail
",unspecified,60000.0,75000.0,Unspecified,Expérience exigée,Contrat à durée indéterminée,False
0530002,https://candidat.pole-emploi.fr/offres/recherche/detail/0530002,2024-01-30,Offre d'emploi Datascientist - Dataengineer H/F - 92 - NANTERRE - 0530002 | Pôle emploi,92 - NANTERRE,"POSTE : Datascientist - Dataengineer H/F
DESCRIPTION : Dans le cadre de la création d'une ""Digital Factory"" SCC, nous recherchons notre futur(e) DATA ENGINEER CONFIRME H/F afin de rejoindre nos équipes ainsi qu'un (e) DATASCIENTIST H/F

En tant que DATA ENGINEER, vous serez :
Responsable de la structuration des données associés aux cas d'usages métiers / IA.
Amené(e) à concevoir, développer et déployer des pipelines de données.
Capable de travailler en étroite collaboration avec les développeurs et les data Scientists pour créer des solutions innovantes qui répondent aux besoins de nos clients.
PROFIL : Qui êtes vous :
De formation supérieure en informatique, mathématiques, statistiques ou domaine connexe, vous justifiez d'au moins 5 ans d'expérience sur un poste similaire.
Vous justifiez d'au moins 3 à 5 ans dans la conception, le développement et le déploiement de pipelines de données.
Vous avez acquis une expertise sur technologies de données telles que Hadoop, Spark, Hive, Pig, MySQL, PostgreSQL, etc.
Vous avez une très bonne maîtrise de SQL, Python et R ainsi qu'une bonne compréhension des principes de l'ingénierie logicielle
Par ailleurs, vous avez de très bonnes compétences autour des environnements cloud et les services data utilisés tel que Azure Data Factory, synapse, Azure DataBricks, Aws EMR, Aws Glue.
Pourquoi nous rejoindre :
Un contexte dynamique, en croissance sur un marché porteur, et l'opportunité d'être un acteur du développement de notre société,
Intégrer une entreprise familiale où il fait bon travailler, SCC est une aventure humaine où bienveillance et convivialité font partie du quotidien,
Prendre part à la culture du management de SCC et à la transformation de l'entreprise,
Profitez d'avantages tels que la mutuelle & complémentaire santé, une participation, les offres du CSE et des RTT, possibilité de choisir entre un PC portable ou un McBook
Carte restaurant de 8.50EUR par jours, pris en charge à hauteur de 4.90EUR par SCC. (RAC 3, 60EUR)
Bénéficiez jusqu'à deux jours de télétravail.
Rémunération en package : fixe+ variable sur objectifs selon le profil.
Statut : CADRE, convention collective SYNTEC.
A vos CV, au plaisir d'échanger.","
Contrat à durée indéterminée

Contrat travail
",unspecified,unspecified,unspecified,Unspecified,Expérience exigée,Contrat à durée indéterminée,False
0516168,https://candidat.pole-emploi.fr/offres/recherche/detail/0516168,2024-01-30,Offre d'emploi Data Scientist H/F - 77 - REAU - 0516168 | Pôle emploi,77 - REAU,"POSTE : Data Scientist H/F
DESCRIPTION : Au sein de la Direction des Bureaux d'Etudes Systèmes Propulsifs de Safran Aircraft Engines, le pôle Analyse de Risques en Exploitation (ARE) du service Sûreté de Fonctionnement s'occupe particulièrement de modéliser la fiabilité / sécurité des moteurs en exploitation.

Dans ce cadre, vous serez amené à intervenir sur tous les produits civils et militaires de Safran Aircraft Engines certifiés ou qualifiés.

Vous serez notamment en charge des activités techniques suivantes :
-  Analyser les événements en production et en service à l'aide de modèles de survie à partir de données censurées et évaluer statistiquement les risques associés pour les flottes
-  Réaliser les notes de justification / capitalisation
-  Participer aux activités d'améliorations / optimisation des codes développés pour les analyses statistiques
-  Contribuer à la captation et à l'analyse du retour d'expérience en service
-  Participer activement au développement et à la mise en oeuvre du plan de progrès du service sur les thématiques analyses statistiques & analyse du retour d'expérience

A cette fin, vous travaillerez en interface avec de nombreux acteurs au sein de l'entreprise (bureaux d'études de la Direction Technique et de la Direction Industrielle, Support Client, Marques Techniques).
PROFIL : Diplômé-e Bac +5 avec une spécialisation dans les domaines mathématiques, statistiques, vous disposez idéalement d'une première expérience dans l'industrie.

Vous disposze de compétences en statistiques descriptives et inférentielles, modélisation statistiques.

Vous avez des fortes connaissances en statistiques, R / Python

La maîtrise des systèmes de propulsion aéronautique est un plus.

Vous êtes curieux-se, motivé-e, pluridisciplinaire et force de proposition.

Vous parlez anglais, une troisième langue est un plus.","
Contrat à durée indéterminée

Contrat travail
",unspecified,unspecified,unspecified,Unspecified,Expérience exigée,Contrat à durée indéterminée,False
0515727,https://candidat.pole-emploi.fr/offres/recherche/detail/0515727,2024-01-30,Offre d'emploi Data Scientist IA H/F - 93 - MONTREUIL - 0515727 | Pôle emploi,93 - MONTREUIL,"POSTE : Data Scientist IA H/F
DESCRIPTION : Concrètement votre quotidien ?

Vous participerez à la transformation des métiers de la banque grâce à l'Intelligence Artificielle pour une grande diversité de métiers (Retail, Corporate, Fonctions groupe, Opérations). De nombreux cas d'usages permettent de pouvoir diversifier les modèles utilisés.

Vos principales missions seront de :
- Analyser et interpréter des ensembles de données complexes pour identifier des tendances, des modèles et des corrélations qui peuvent avoir un impact sur les décisions commerciales ou l'amélioration de la satisfaction de nos clients.
- Développer les modèles statistiques ou prédictifs tout en assurant une transformation de la donnée et le paramétrage adapté de ces modèles.
- Participer à la mise en place de stratégies de gestion des données, y compris la conception et la mise en oeuvre de bases de données, la sélection des outils d'analyse de données et la définition des normes de qualité des données
- Rester à jour sur les dernières avancées dans le domaine de la Data Science

Et après ?

Les métiers de la data/IA et de l'informatique offrent de nombreuses opportunités au sein du Groupe, dans toutes les activités de la banque, partout dans le monde Les passerelles sont multiples !

BNP Paribas, c'est plus de 300 métiers et une vaste offre de formation pour vous permettre de monter en compétences et d'évoluer tout au long de votre parcours professionnel.

Les avantages à nous rejoindre

Un package rémunération et des avantages :  
-  Un fixe annuel brut et un variable individuel (défini en fonction de votre performance et de celle de votre équipe).
-  Plan épargne entreprise/retraite, intéressement et participation, couverture santé et prévoyance, activités sociales et culturelles via le comité d'entreprise,
-  De la flexibilité avec un rythme de travail hybride :  jusqu'à 2, 5 jours de télétravail par semaine à définir avec votre manager.

Rejoignez un Groupe engagé et prenez part à notre grand projet de transformation vers la construction d'un monde plus durable. Découvrez nos engagements pour notre clientèle et la société.  
Engagez-vous à nos côtés sur votre temps professionnel, à travers notre programme OneMillionHoursToHelp.

Avez-vous le profil ?

Titulaire d'un Bac +5 avec une spécialisation Intelligence Artificielle et avez au moins 5 ans d'expérience dans ce domaine.

Vous avez une excellente maîtrise de Python et maîtrise de SQL. La connaissance de spark est un plus.

Votre connaissance d'outils ML Ops (de type Gitlab) et de qualité continue de code (de type Sonarqube) vous permettra de déployer de manière opérationnelle et industrielle les solutions IA que vous développerez.

Vous savez monitorer la performance des solutions IA déployées.

Vous avez une forte culture « open source ». Vous êtes à l'aise dans l'utilisation et la gestion des plateformes d'IA basées sur la conteneurisation.

Vous avez déjà expérimenté la mise en oeuvre de réseaux de neurones (Transformers, modèles génératifs, OCR) ou de modèles de Machine Learning pour répondre à des problématiques complexes (fraude, AML, optimisation marketing,).

Votre avez des compétences dans le domaine de l'extraction d'informations sur documents numérisés/scannés (IDP) et savez modéliser/intégrer des solutions développées dans le domaine du NLP.

Votre capacité à collaborer vous permettra d'évoluer dans une organisation agile où les échanges avec des collaborateurs d'expertises variées et la compréhension du besoin du métier sont essentiels.

Vos capacités d'analyse et de synthèse et votre orientation résultats finiront de nous convaincre.

Votre anglais est opérationnel

Les prochaines étapes / Les étapes du recrutement

Si votre CV est retenu par notre équipe de recrutement, vous serez amené à passer un à trois entretiens au maximum avec des RH et/ou manager opérationnel. Ces étapes peuvent varier légèrement en fonction des postes.

Si vous êtes dans une situation de handicap et souhaitez un échange facilité, vous pouvez envoyer votre CV et lettre de motivation à @.**.

Dans un monde qui change, la diversité, l'équité et l'inclusion sont des valeurs clés pour le bien-être et la performance des équipes. Chez BNP Paribas, nous souhaitons accueillir et retenir tous les talents sans distinction : c'est ainsi que nous construirons, ensemble, la finance de demain, innovante, responsable et durable

Enfin, nous attachons une importance particulière à ce que nos futurs collaborateurs et collaboratrices agissent au quotidien avec responsabilité éthique et","
Contrat à durée indéterminée

Contrat travail
",unspecified,unspecified,unspecified,Unspecified,Expérience exigée,Contrat à durée indéterminée,False
0515550,https://candidat.pole-emploi.fr/offres/recherche/detail/0515550,2024-01-30,Offre d'emploi Data Scientist For Audit CDI H/F - Ile-de-France - 0515550 | Pôle emploi,Ile-de-France,"POSTE : Data Scientist For Audit CDI H/F
DESCRIPTION : Dans nos équipes d'audit, nous avons investi significativement dans les technologies émergentes pour comprendre les processus, technologies et systèmes utilisés par nos clients et remodeler en profondeur nos approches métier.

Notre équipe Data Science for Audit fait partie intégrante de cet eco-système. Nous fournissons et développons des initiatives technologiques sur tous les secteurs de nos clients.

Nous faisons cela à travers notre expertise en analyse de données, robotique, IA, GenAI, machine learning et en utilisant les meilleures pratiques existantes sur le marché.

Nos équipes travaillent également directement avec nos clients pour générer des informations pertinentes et faire parler les données afin de nous permettre d'avoir une meilleure compréhension de l'évaluation de leurs risques.

Ce que vous pouvez attendre de nous :

L'équipe data est une équipe hautement qualifiée, performante, diversifiée et leader dans l'implémentation de solutions technologiques avancées pour l'audit. En tant que spécialiste data, vous allez :
-  Conseiller les équipes d'audit sur les moyens d'automatiser et de réinventer nos missions, en mettant en oeuvre des technologies innovantes, telles que GenAI/Machine Learning et Python.
-  Construire une solide compréhension du rôle que jouent la donnée et l'analyse dans la finance moderne.

Nous sommes en partenariat avec des acteurs majeurs de la Tech tels que OpenAI, Microsoft, Google, Databricks et Harvey.

Vous travaillerez sur des missions vous permettant de développer des compétences en analyse avancée, en GenAI et Machine Learning, en ingénierie des données et sur des outils de visualisation pour offrir aux clients l'expérience digitale de PwC. Cela signifie que vous développerez les compétences techniques et commerciales autour du thème des données et de l'analyse que nos clients exigent aujourd'hui.

En tant que principal acteur de l'analyse de la donnée pour l'audit de PwC France, vous travaillerez en étroite collaboration avec des clients et équipes d'audit dans un large éventail de secteurs (ex. Distribution, Retail, Pharmaceutique, Energie, Télécommunications, Banque, Assurance, etc.).

Formation et développement :

Grâce à notre programme de formation sur mesure, vous développerez les bases pour devenir un professionnel de la Data Science hautement qualifié. Vous bénéficierez également du soutien d'une équipe dynamique et expérimentée qui vous aidera à orienter votre carrière, afin que vous puissiez toujours donner le meilleur de vous-même.

Notre objectif est de nous assurer que nos collaborateurs obtiennent des accréditations externes pertinentes (combinaison de compétences soft skills et techniques), vous distinguant ainsi comme expert de la Data.

Ce que nous attendons de vous :
- 
De formation supérieure, vous avez 3-5 ans d'expérience dans la Data
-  Vous êtes capables d'accompagner des missions d'audit à l'aide de l'analyse de données et de technologie émergente (ex. LLM GenAI, Machine Learning)
-  Un développement d'approches innovantes en lien avec les équipes métiers grâce à un socle de compétence solide, notamment :  - Connaissance GenAI (ex. OpenAI, VertexAI, Llama, Mistral)
-  Compréhension des problèmes courants de qualité des données et de leurs effets sur les modèles GenAI et Machine Learning
-  Transformer et modéliser (ex. pandas, polars et scikit-learn pour Python)
-  Data storage et interrogation (ex. ChromaDB, SQL, Alteryx)
-  Data visualisation (ex. PowerBI, Seaborn)
-  Nettoyage et manipulation des données pour le GenAI et Machine Learning (ex. feature engineering)
-  Vous êtes dynamique et aimez le travail en équipe et surtout : accompagner, transmettre et partager c'est votre leitmotiv !
-  Vous avez commencé à développer vos compétences d'encadrement et de coaching d'équipe, et vous voulez aller plus loin dans la revue des travaux de l'équipe et leur supervision
-  Vous avez à coeur de tisser un lien de confiance avec l'équipe et les auditeurs
-  Comme les équipes sont multiples et partout, vous savez vous adapter
-  La maîtrise de l'anglais est essentielle car votre quotidien chez PwC est ouvert sur le monde
-  L'organisation, la rigueur, la curiosité et un excellent relationnel vous permettront de réussir sur ce poste

Ces avantages que nous vous offrons :

· Flexibilité avec la charte FlexWork : télétravail étendu, mobilité géographique, FlexTime, Dress for your day

· Pass mobilité durable pour couvrir vos dépenses de mobilité durable

· Programme BE Well, Work Well pour prendre soin de sa santé (partenariat Gymlib, applicat","
Contrat à durée indéterminée

Contrat travail
",unspecified,unspecified,unspecified,Unspecified,Expérience exigée,Contrat à durée indéterminée,False
