id,url,date,title,location,description,info,horaires,salairemin,salairemax,entreprise,experience,contrat,debutant
163QGXX,https://candidat.pole-emploi.fr/offres/recherche/detail/163QGXX,2023-10-20,Offre d'emploi Lead data scientist (H/F) - 31 - TOULOUSE - 163QGXX | Pôle emploi,31 - TOULOUSE,"Vos missions: 
-Suivre l'état de l'art, implémenter et entraîner des réseaux et algorithmes de perception .
-Créer et analyser les données nécessaires à l'entraînement et l'évaluation, notamment en utilisant des outils de simulation photo-réaliste.
-Optimiser les datas, architecture et feature backbones pour créer des réseaux généralistes aussi performants que des réseaux spécialistes.
-Accélérer les pipelines de training et d'augmentation.
-Contribuer à une intégration complète de vos solutions en production.

Profil recherché: 
-Au moins 7 ans d'expérience dans data science dont 5 ans d'expérience sujet IA et traitement d'image 
-Spécialisé en computer vision et analyse de flux vidéo","
Contrat à durée indéterminée

Contrat travail
",35H Travail en journée,unspecified,unspecified,Menaps,7 ans,Contrat à durée indéterminée,False
163QCYS,https://candidat.pole-emploi.fr/offres/recherche/detail/163QCYS,2023-10-20,Offre d'emploi Stagiaire Data Scientist (H/F) - 74 - CLUSES - 163QCYS | Pôle emploi,74 - CLUSES,"Description de l'entreprise
Partenaire de confiance pour l'automatisation des ouvertures et des fermetures de la maison et du bâtiment, SOMFY s'engage pour inspirer de nouvelles façons de vivre pour tous.¿Groupe français, familial et indépendant, en croissance continue depuis notre création, nous sommes leader mondial de l'automatisation de la maison depuis 50 ans et pionnier de la domotique. L'innovation guide notre quotidien et garantit l'excellence de nos solutions.¿Nous sommes présents dans 58 pays, et comptons 8 sites de production et 17 centres de R&D.¿¿Profondément attachés au bien-être de nos 7000 collaborateurs, nous nous engageons pour leur employabilité durable par la mobilité interne et le développement de leurs compétences. Nous encourageons la diversité et l'inclusion en nous appuyant sur notre culture d'entreprise forte.
Description du poste
Au sein de la Digital Factory vous exercerez toutes les activités d'un Data Scientist dans un contexte Agile et international de cycles de livraisons rapides.  
Rattaché(e) à un Data Scientist Senior, vous aurez comme principales missions, dans le cadre d'un projet orienté Marketing¿: 
	-	Collaborer avec l'équipe projet à la fois Tech et Business 
	-	Comprendre les données (sources, qualité, structure, notamment) 
	-	S'approprier les problématiques business et tech rencontrées sur le projet 
	-	Contribuer à l'industrialisation du projet en cours en mode Agile 
	-	Participer au développement de modèles de Machine Learning 
	-	Recueillir les besoins Business 
	-	Faire un état des lieux des données disponibles et définir les données supplémentaires à obtenir 
	-	Evaluer la qualité des données à disposition 
	-	Contribuer aux développements d'algorithmes de Machine Learning en cours et à la création de features  
	-	Construire et entraîner des modèles 
	-	Tester et évaluer différents modèles concurrents 
	-	Mettre en place du monitoring et de l'alerting via des dashboards et visualisations 
	-	Documenter les développements réalisés 
	-	Présenter le travail accompli 
Qualifications
Etudiant(e) en école d'ingénieur ou à l'université, niveau d'étude (bac + 5), vous avez un cursus centré sur l'analyse de données et l'Intelligence Artificielle. 
Connaissances¿: Concepts de Machine Learning et de l'analyse de données, langage de programmation¿: Python/SQL, visualisation de données¿: Power BI/Tableau,  Dataiku. 
Qualités/Savoir-être¿: autonomie, curiosité, proactivité, rigueur et esprit d'équipe 
Langues¿: Français, Anglais (C1 minimum) 
A la fin de ce stage vous serez capable de¿: 
	-	Comprendre les enjeux, notamment techniques et business, soulevés lors de d'implémentation de solutions d'I.A. dans une grande entreprise. 
	-	Mettre en œuvre des concepts MLOps, Agile et d'industrialisation de données et de solution 
	-	Contribuer en équipe au développement de solutions de Machine Learning en intégrant une compréhension et prise en compte élevée des besoins métiers. 
Informations complémentaires
	-	
Contrat : Stage¿Durée : 6 mois¿Date de démarrage : mars/avril 2024¿Localisation : Cluses (env 45 min d'Annecy)
Notre Groupe Vous intéresse ? Vous recherchez une société ou vous développer et vous épanouir ? Rejoignez-nous !

La protection des données personnelles de nos candidats est un engagement du Groupe Somfy. Nous demandons donc à tout candidat de nous soumettre sa candidature exclusivement via notre système sécurisé, et non par e-mail ou par courrier postal.","
Contrat à durée déterminée - 6 Mois

Contrat apprentissage
",35H Travail en journée,unspecified,unspecified,Somfy activites sa,Débutant accepté,Contrat à durée déterminée - 6 Mois,True
4568764,https://candidat.pole-emploi.fr/offres/recherche/detail/4568764,2023-10-20,Offre d'emploi Data scientist (H/F) - 75 - PARIS 09 - 4568764 | Pôle emploi,75 - PARIS 09,"Description du poste :
Vous cherchez à acquérir des compétences d'aujourd'hui et un métier qui a de l'avenir en alternance?
Notre mission : rendre l'éducation accessible à tous.
L'alternance avec OpenClassrooms, c'est apprendre un métier avec une formation mêlant 20 % de théorie et 80 % de pratique, pour être 100 % prêt à l'emploi ! Grâce à nos équipes, qui épaulent chaque profil dans la recherche d'un employeur, nous affichons un taux d'insertion de nos étudiants de plus de 80 % en entreprise !
Notre école en ligne propose des centaines de formations sur des métiers du numérique, 100 % en ligne, avec un diplôme reconnu par l'État à la clé. Vous former avec OpenClassrooms, c'est aussi rejoindre une communauté internationale de plus de 12 000 étudiants actifs et motivés, dans 72 pays.
Nous recherchons un profil motivé pour occuper le poste de Data Scientist Python/Machine Learning en alternance pour une de nos entreprises partenaires (grande distribution, secteur bancaire, luxe, services, etc.).
Si votre candidature est retenue, votre scolarité sera entièrement financée par votre employeur.
Attention : pour postuler à cette offre en alternance, vous devez faire une formation diplômante avec OpenClassrooms ou réaliser un changement d'école dans le cadre d'un contrat en alternance.
Description de l'entreprise
: BLIINK, acteur clé du ciblage contextuel pour la publicité en ligne à l'ère du cookieless, cherche un(e) alternant(e) en tant que data scientist, spécialisé(e) en Python et Machine Learning, pour rejoindre notre équipe en pleine croissance. Notre technologie propriétaire classe chaque jour des millions de pages web, de produits et de publicités afin d'offrir aux internautes le meilleur contenu au meilleur moment. Nous sommes à la recherche d'un(e) alternant(e) passionné(e) et curieux(se), désireux(se) de s'impliquer et de grandir au sein de notre équipe.
Missions
:***Participer à la conception, au développement et à l'implémentation de modèles de Machine Learning.***Travailler sur des projets liés au traitement du langage naturel (NLP) et/ou à la vision par ordinateur (Computer Vision).***Collaborer avec notre équipe pour améliorer continuellement nos modèles et algorithmes existants.***Aider à l'analyse des performances de nos modèles et proposer des améliorations.***Description du profil :
Profil recherché
:***Bonne connaissance de Python et de ses bibliothèques de science des données (p.ex.***Pandas, NumPy, SciKit-Learn).***Connaissances en Machine Learning et une volonté de se perfectionner dans ce domaine.***Notions de base ou intérêt pour le traitement du langage naturel (NLP) et/ou la vision par ordinateur (Computer Vision).***Capacité à travailler en équipe, à communiquer efficacement et à résoudre des problèmes.***Compétences supplémentaires appréciées :***Familiarité avec les frameworks de Machine Learning tels que TensorFlow ou PyTorch.***Intérêt pour le domaine de la publicité ou de l'affiliation serait un plus.***Intérêt pour la veille technologique.***Si vous êtes un(e) étudiant(e) passionné(e), prêt(e) à apprendre et à apporter votre énergie à une équipe innovante, nous aimerions vous rencontrer.***Rejoignez BLIINK et participez à la création d'une technologie publicitaire de pointe.***Pré-requis à la formation
Pour postuler à cette offre en alternance, vous devez faire une formation diplômante avec OpenClassrooms ou réaliser un changement d'école dans le cadre d'un contrat en alternance.","
Contrat à durée déterminée - 24 Mois

Contrat apprentissage
",unspecified,unspecified,unspecified,Unspecified,Débutant accepté,Contrat à durée déterminée - 24 Mois,True
4562121,https://candidat.pole-emploi.fr/offres/recherche/detail/4562121,2023-10-20,Offre d'emploi Data scientist (H/F) - 53 - LAVAL - 4562121 | Pôle emploi,53 - LAVAL,"Description du poste :
Mission
Au sein du pôle Études Statistiques et avec l'équipe Data Science, votre mission s'inscrit dans l'exploitation judicieuse des données existantes afin de fournir aux différentes directions une aide efficace à la prise de décision.
Dans ce cadre vos principales missions seront de :
- Mettre en place des outils statistiques permettant l'exploitation des bases de données existantes (fournisseurs, vente d'articles etc.) des services opérationnels.
- Créer des tableaux de bord adaptés aux problématiques spécifiques des différents clients internes.
- Modéliser et automatiser, sur des méthodes statistiques adéquates, des analyses débouchant sur des propositions pertinentes d'amélioration des directions opérationnelles (réseau de magasin, service commercial et centrale d'achat / vente, logistique).
Profil recherché
Diplômé(e) d'un Master en mathématiques, statistique ou informatique décisionnelle, vous avez une première expérience de la Data Science.
Rigoureux(se), fiable et organisé(e), votre savoir être vous permet d'avoir le sens du détail et de rentrer dans l'analyse.
Proactif(ve) et force de proposition, votre curiosité et votre sens de l'adaptation vous permettront de réussir pleinement sur ce poste.
Vous avez des connaissances sur des logiciels statistiques (R, Python) et Excel.
Dans le cadre de sa politique de diversification, Le Service Recrutement de l'Univers NOZ étudie à compétences égales toutes les candidatures dont celles des personnes en situation de handicap.
Pays : France
Région :
Ville : Laval, Pays de la Loire, FR
Référence : 000","
Contrat à durée indéterminée

Contrat travail
",unspecified,unspecified,unspecified,Unspecified,Expérience exigée de 1 An(s),Contrat à durée indéterminée,False
163PBFK,https://candidat.pole-emploi.fr/offres/recherche/detail/163PBFK,2023-10-20,Offre d'emploi Data scientist - 75 - PARIS 03 - 163PBFK | Pôle emploi,75 - PARIS 03,"Faktus est à la recherche d'un Junior Data Scientist pour rejoindre notre équipe dynamique. 

En tant que Junior Data Scientist, vous jouerez un rôle essentiel dans l'analyse des données, l'analyse
financière, et l'implémentation de modèles de NLP pour l'extraction de données automatisée à l'appui
de nos activités de financement de BFR dans le secteur de la construction.

Responsabilités :

Effectuer l'analyse des données à l'aide d'outils de Business Intelligence.
Contribuer à l'analyse financière des bilans en utilisant des technologies modernes.
Mettre en oeuvre des modèles de NLP pour l'extraction automatisée de données à partir de documents
financiers.

Déployer les modèles et les solutions sur des serveurs ou sur le cloud.
Collaborer avec notre équipe pour soutenir nos initiatives de financement de BFR dans le secteur du  bâtiment.

Le candidat (idéal) devra :

****Être diplômé d'une grande école d'ingénieurs****

****Posséder une expertise solide en Python et savoir manipuler des bases de données hétérogènes****
(SQL/NoSQL).

****Avoir des compétences en NLP et une passion pour ce domaine****

****Savoir utiliser des outils de BI tels que Power BI et Tableau Software****

****Avoir la capacité de déployer des modèles sur des serveurs/cloud****

****Afficher un intérêt marqué pour la finance****

****Avoir une expérience préalable grâce à des stages, alternances, missions de freelance ou des projets****
de recherche en Data dans divers secteurs.

****Avoir des expériences avec des startups, et de préférence, avoir participé au développement de
prototypes de projets de startup....*****","
Contrat à durée indéterminée

Contrat travail
",35H Travail en journée,40000.0,45000.0,Faktus,1 an,Contrat à durée indéterminée,False
4538672,https://candidat.pole-emploi.fr/offres/recherche/detail/4538672,2023-10-19,Offre d'emploi Data Scientist (H/F) - 92 - Hauts de Seine - 4538672 | Pôle emploi,92 - Hauts de Seine,"Description de l'entrepriseLe Groupement Les Mousquetaires, ce sont 7 enseignes de la grande distribution portées haut et fort par plus de 3 000 chefs d'entreprise indépendants ! Ce sont aussi 150 000 collaborateurs mobilisés autour de notre modèle unique de producteurs et commerçants. Et nous en sommes fiers ! Dans toutes les fonctions au service des points de vente, de la logistique à l'immobilier, en passant par l'industrie agroalimentaire ou l'informatique, nos équipes font nos succès. Chez Intermarché & Netto (ITM AI) les enseignes alimentaires du Groupement, notre goût d'entreprendre, notre indépendance et la diversité de nos métiers nous permettent d'avoir un impact sur toute la chaîne de production pour répondre aux nouvelles attentes des consommateurs. Chaque jour, nos équipes réunissent leurs compétences autour de la table pour faire vivre notre tâche : ""Ensemble, agissons pour placer le mieux manger à la portée de tous"". Envie de vous engager concrètement dans l'action avec nous pour relever nos défis d'aujourd'hui et de demain ? Parlons-en très vite !Description du posteITM Alimentaire International, branche alimentaire du Groupement Les Mousquetaires, recherche un(e) stagiaire en Data Science pour rejoindre son équipe Data Science & Analytics au sein du département Data.Partant(e) pour l'aventure ?Alors rejoins la Data Factory Intermarché/Netto, née de l'ambition d'Intermarché de se transformer par la Data au service de ses clients, de ses salariés, et de ses dirigeants. Les bénéfices du Cloud Azure de Microsoft et ses technologies d'Intelligence Artificielle, telles que le Machine Learning, le Natural Language processing ou encore la Computer Vision vont nous permettre de proposer une offre personnalisée tant au niveau de chaque point de vente qu'au niveau de chaque consommateur.Concrètement, quelles seront tes tâches ?La notion de points de vente comparables est une notion clé dans le retail alimentaire. Elle consiste à identifier des groupes de points de vente similaires. Elle peut, par exemple, être exploitée pour analyser l'impact des différentes actions promotionnelles, en comparant les ventes réalisées par les points de vente participants à celles de points de vente « témoins » qui ont les mêmes caractéristiques.Or, la notion de similarité est très variable d'un contexte à un autre. Elle peut, en fonction de ce dernier, faire intervenir des indicateurs lies aux performances (chiffre d'affaires, .), aux clients (leurs profils socio-économiques, leurs dépenses moyennes, .), à l'assortiment (produits proposés en vente et leurs caractéristiques), à l'intensité de la concurrence, . Les tâches suivantes vous seront confiées au sein de l'équipe :Collecter et analyser les sources de données à exploiter pour aider les métiers dans leur processus et développer l'offre DATA Proposer des modélisations statistiques et mettre en place des algorithmes d'apprentissage Initier les travaux d'industrialisation des approches proposées dans le cloud Microsoft Azure.Contribuer à la vie d'équipe en participant aux différentes actions d'acculturation qu'elle mène auprès des métiers et en présentant vos travaux de façon régulière.QualificationsEt si votre parcours venait nourrir notre tâche ? Vous préparez actuellement un diplôme de niveau BAC+5 (école d'ingénieurs ou Master 2) en Data Science.Bonne maîtrise (niveau intermédiaire) de Python et des packages classiques d'analyse de données (pandas, scikit-learn, .).Connaissances théoriques et opérationnelles solides en Machine Learning (apprentissage supervisé et non-supervisé).Capacité à présenter vos travaux de façon claire et structurée et à adapter votre discours à un public diversifié.Rigueur scientifique, autonomie, curiosité et force de proposition.Bon relationnel et fort esprit d'équipe.Appétence pour les problématiques data dans le retail.Vous recherchez un stage de 6 mois à partir de Janvier 2024 Informations supplémentairesNous vous proposons :Une tâche responsabilisante pour développer votre employabilité et autonomieUn accompagnement aux petits oignons tout au long de votre parcours par votre tuteur, manager et chargé de RHGratification : 1200€ brut par mois pour un stage 2 jours de télétravailVous avez envie de rejoindre notre promotion de jeunes pousses Intermarché & Netto 2024 ? Parlons en très vite !! ITMHIRING","
Contrat à durée indéterminée

Contrat travail
",unspecified,unspecified,unspecified,Forum emploi-formation-alternance: talents handicap,Débutant accepté,Contrat à durée indéterminée,True
4535645,https://candidat.pole-emploi.fr/offres/recherche/detail/4535645,2023-10-19,Offre d'emploi CDI- Senior Data Scientist (H/F) - Gif-sur-Yvette (91) - 91 - GIF SUR YVETTE - 4535645 | Pôle emploi,91 - GIF SUR YVETTE,"Danone France ne cherche pas à être la meilleure entreprise au monde, mais meilleure pour le monde ! C'est pour cela que nos 26 marques en France sont certifiées B Corp TM. *

B Corp est la boussole de notre stratégie RSE ! Cette certification permet de nous remettre en question afin de progresser continuellement et mesurer notre performance sociale et environnementale.

Le département Medical & Nutritional Science recrute un.e Data Scientist senior en CDI dans léquipe Clinical Research & Health Data. Le poste est basé à Gif-sur-Yvette (91) sur le plateau de Saclay au sein du Danone Global Research & Innovation Center Centre Daniel Carasso qui est au cœur de la Recherche & Innovation de Danone. Il est constitué de laboratoires et d'ateliers pilotes à la pointe de la science et de la technologie avec des collaborateurs œuvrant collectivement pour innover sur les produits laitiers et végétaux, les eaux et la nutrition spécialisée de demain.

La direction R& I Medical & Nutritional Science a pour vocation de créer de la valeur et des opportunités de croissance pour Danone autour de la Nutrition et/ou de la Santé.

Rattaché.e au chef déquipe Data Science & Data Engineering, le/la Data Scientist Senior a pour mission de :

Réaliser des analyses de bout en bout pour différents départements de la R& I de Danone, pour les équipes de Gif-sur-Yvette, de France, des Pays-Bas, de Singapour, du recueil du besoin métier à lanalyse et la mise en production des produits Data Science développés selon les bonnes pratiques Data Science établies

Travailler en collaboration avec les autres experts data (e.g. Data Architect, Data Engineer, expert BI)

Réaliser une veille régulière des techniques Data Science, identifier les opportunités pour les autres métiers de la R& I , les présenter, concevoir des roadmaps pour les projets data

Communiquer à nos partenaires de la R& I des résultats et concepts data avec pédagogie

Contribuer à lharmonisation et la standardisation des pratiques de Data Science dans léquipe, et faciliter lapplication de ces bonnes pratiques par des profils Data Science plus juniors

La garantie d'un package de rémunération pertinent, compétitif et évolutif grâce à un benchmark externe et une équité interne. Il se compose entre autres d'un salaire fixe, d'un variable annuel, d'une prime dintéressement et/ou participation et d'une action Danone.

Une flexibilité de travail et lieux de travail avec télétravail hebdomadaire de 2 jours.

Le développement des compétences de chacun avec la Danone Academy France et un cycle de conversation managérial.

La possibilité d'utiliser 3 jours par an de bénévolat via notre plateforme Vendredi.

Des avantages pour la parentalité et les aidants avec la possibilité de convertir une partie de sa rémunération en temps. Notamment 14 jours de plus de congé maternité / paternité.

D'autres avantages tels que la mutuelle, la retraite supplémentaire, le CSE, 100% du pass Navigo remboursé

Les indispensables :

Formation M.Sc. ou équivalent, voire Ph.D., idéalement en Data Science, Mathématiques Appliquées ou Statistiques

Excellente maîtrise de python, pandas, github, shell, voire R

Très bonne pratique des outils de Data Science python: scikit-learn, pytorch, tensorflow, keras 

Passionné par la Data Science et ses applications

Français et Anglais courants

Bon relationnel, bonne communication, curieux, aptitudes en résolution de problèmes

Les + :

Expérience ou connaissances en biologie, science de la vie, biotechnologie

Expérience professionnelle dans lindustrie dans des rôles similaires, au sein dun data lab par exemple

Participation à des compétitions kaggle, hackathon 

Nous sommes fiers de promouvoir la diversité et légalité des chances au sein de nos équipes. Nous sommes convaincus que nos différences font la différence et quun environnement de travail inclusif stimulera notre croissance en tant qu'entreprise, en tant qu'équipes et en tant qu'individus. Nous considérerons donc toutes les candidatures* en favorisant une culture de travail inclusive où chaque individu peut se sentir à sa place.

Aussi, nous avons fait le choix de supprimer lécriture inclusive de nos offres demploi car sa complexité pénalise les personnes affectées dun handicap cognitif, notamment la dyslexie, la dysphasie ou lapraxie.

*Toutes les candidatures seront considérées sans tenir compte de lorigine, du parcours, de la religion, du sexe, de lorientation sexuelle, de lidentité de genre, du handicap

Nos quatre valeurs fondamentales ""HOPE"" : HUMANISME, OUVERTURE, PROXIMITÉ et ENTHOUSIASME nous servent de b","
Contrat à durée indéterminée

Contrat travail
",unspecified,unspecified,unspecified,Unspecified,Débutant accepté,Contrat à durée indéterminée,True
