id,url,date,title,location,description,info,horaires,salairemin,salairemax,entreprise,experience,contrat,debutant
5670619,https://candidat.pole-emploi.fr/offres/recherche/detail/5670619,2024-04-22,Offre d'emploi Data Analyst (H/F) - A pourvoir dès Juin - 92 - RUEIL MALMAISON - 5670619 | France Travail,92 - RUEIL MALMAISON,"Localisation: Saint Denis 

 

 

Paris 2024, cest une équipe de plus dun millier de collaborateurs passionnés qui ensemble, sapprêtent à offrir au monde entier le plus grand événement jamais organisé en France : Les Jeux Olympiques et Paralympiques.

Être un collaborateur de Paris 2024 cest partager une aventure humaine unique.

Cest lopportunité de développer ses compétences comme nulle part ailleurs pour un projet rapide, challengeant et sur le devant de la scène. Cest un véritable accélérateur de carrière.

Cest chaque jour sapprocher du but et se challenger pour donner le meilleur : Partage, Exigence, Créativité.

 

 

Le Comité d'organisation des Jeux Olympiques et Paralympiques Paris 2024 rechercheune/un Data analyst pour la période de Juin à Septembre. 

 

Dans le respect du contrat de ville hôte, signé par le Comité International Olympique (CIO), la Ville de Paris et le Comité National Olympique et Sportif Français (CNOSF), Paris 2024 est notamment chargé de : 

 

 * Planifier, organiser, financer et livrer les Jeux Olympiques et Paralympiques de Paris 2024; 

 * Promouvoir les Jeux Olympiques et Paralympiques de Paris 2024 en France et à l'international ; 

 * Participer aux actions visant à assurer la durabilité des Jeux Olympiques et Paralympiques de Paris 2024 ; 

 * Contribuer à maximiser l'impact positif et l'héritage des Jeux Olympiques et Paralympiques de Paris 2024. 

Au sein de la Direction Digital / Data / CRM du COJO, le pôle data a pour mission de centraliser les données en lien avec les fans, spectateurs, visiteurs et clients de Paris 2024 puis produire des analyses en support des différentes directions dans le respect du RGPD. Rattaché au Responsable Data & Analytics , le Data analyst aura ainsi pour mission de traiter et analyser les données venant de nombreuses sources différentes afin doptimiser la performance commerciale, lexperience fans & spectateurs et les opérations événementielles. 

 

Pendant la période des Jeux Olympiques et Paralympiques, votre staffing sera basé sur un système de shifts avec les autres membres de léquipe data pour assurer un support danalyse continue sur lensemble des plages horaires des compétitions prévues. Le/la Data Analyst Games Time sera amené à : 

 

Missions et responsabilités principales :

 

 * Finaliser le recueil des besoins danalyse auprès des différentes directions du COJO (commercial, digital, opérations, engagement), en particulier les besoins de monitoring et reporting pendant la période des Jeux 

 * Contribuer à la collecte, le traitement et la consolidation des données générées par lécosystème digital de Paris 2024 (plateformes Club, billetterie, licensing, hospitalités, sites web, appli mobile, réseaux sociaux, outil CRM, concessionnaires Food & Beverage ) 

 * Produire et diffuser des analyses ou des tableaux de bord permettantle suivi et loptimisation : 

 * des performances commerciales (analyse des ventes par site, des campagnes marketing) 

 * de lexpérience fans & spectateurs (analyse des communications spectateurs, de lactivité sur les sites web officiels, application mobile et réseaux sociaux) 

 * des opérations événementielles (transports, logistique, sécurité) 

 * Participer à la restitution des analyses lors des réunions quotidiennes avec les différentes directions et le CIO pendant la période des Jeux 

 * Vérifier en continue la qualité et la cohérence des données, garantir la maintenance des dashboards, en particulier pendant la période des Jeux 

 * Le cas échéant, mettre en place des modèles dextrapolation, de prédiction et de scoring 

 

Vos atouts pour réussir : 

 

 * Niveau bac+5 Ecole dingénieur, dinformatique ou Master en data analyse / data management 

 * 2 à 4 ans dexpérience en analyse de données, en entreprise ou cabinet de conseil 

 * Vous maitrisez au moins un outil de restitution et de visualisation de données type Business Intelligence (Reeport, PowerBI) 

 * Vous connaissez les principaux langages de traitement de données (SQL, Python, R) et les solutions datawarehouse de type Google BigQuery 

 * Vous êtes initié aux problématiques data associées aux outils CRM comme Salesforce 

 * Vous avez un esprit danalyse et de synthèse, vous êtes rigoureux et avez le sens de lorganisation 

 * Vous êtes proactif et avez de bonnes compétences relationnelles 

Rejoindre Paris 2024 cest rejoindre une équipe guidée par des valeurs fortes :

Le Partage : Cest lambition de faire avec","
Contrat à durée indéterminée

Contrat travail
",unspecified,unspecified,unspecified,Unspecified,Débutant accepté,Contrat à durée indéterminée,True
5670606,https://candidat.pole-emploi.fr/offres/recherche/detail/5670606,2024-04-22,Offre d'emploi Data Analyst (H/F) - A pourvoir dès Juin - 92 - NANTERRE - 5670606 | France Travail,92 - NANTERRE,"Localisation: Saint Denis 

 

 

Paris 2024, cest une équipe de plus dun millier de collaborateurs passionnés qui ensemble, sapprêtent à offrir au monde entier le plus grand événement jamais organisé en France : Les Jeux Olympiques et Paralympiques.

Être un collaborateur de Paris 2024 cest partager une aventure humaine unique.

Cest lopportunité de développer ses compétences comme nulle part ailleurs pour un projet rapide, challengeant et sur le devant de la scène. Cest un véritable accélérateur de carrière.

Cest chaque jour sapprocher du but et se challenger pour donner le meilleur : Partage, Exigence, Créativité.

 

 

Le Comité d'organisation des Jeux Olympiques et Paralympiques Paris 2024 rechercheune/un Data analyst pour la période de Juin à Septembre. 

 

Dans le respect du contrat de ville hôte, signé par le Comité International Olympique (CIO), la Ville de Paris et le Comité National Olympique et Sportif Français (CNOSF), Paris 2024 est notamment chargé de : 

 

 * Planifier, organiser, financer et livrer les Jeux Olympiques et Paralympiques de Paris 2024; 

 * Promouvoir les Jeux Olympiques et Paralympiques de Paris 2024 en France et à l'international ; 

 * Participer aux actions visant à assurer la durabilité des Jeux Olympiques et Paralympiques de Paris 2024 ; 

 * Contribuer à maximiser l'impact positif et l'héritage des Jeux Olympiques et Paralympiques de Paris 2024. 

Au sein de la Direction Digital / Data / CRM du COJO, le pôle data a pour mission de centraliser les données en lien avec les fans, spectateurs, visiteurs et clients de Paris 2024 puis produire des analyses en support des différentes directions dans le respect du RGPD. Rattaché au Responsable Data & Analytics , le Data analyst aura ainsi pour mission de traiter et analyser les données venant de nombreuses sources différentes afin doptimiser la performance commerciale, lexperience fans & spectateurs et les opérations événementielles. 

 

Pendant la période des Jeux Olympiques et Paralympiques, votre staffing sera basé sur un système de shifts avec les autres membres de léquipe data pour assurer un support danalyse continue sur lensemble des plages horaires des compétitions prévues. Le/la Data Analyst Games Time sera amené à : 

 

Missions et responsabilités principales :

 

 * Finaliser le recueil des besoins danalyse auprès des différentes directions du COJO (commercial, digital, opérations, engagement), en particulier les besoins de monitoring et reporting pendant la période des Jeux 

 * Contribuer à la collecte, le traitement et la consolidation des données générées par lécosystème digital de Paris 2024 (plateformes Club, billetterie, licensing, hospitalités, sites web, appli mobile, réseaux sociaux, outil CRM, concessionnaires Food & Beverage ) 

 * Produire et diffuser des analyses ou des tableaux de bord permettantle suivi et loptimisation : 

 * des performances commerciales (analyse des ventes par site, des campagnes marketing) 

 * de lexpérience fans & spectateurs (analyse des communications spectateurs, de lactivité sur les sites web officiels, application mobile et réseaux sociaux) 

 * des opérations événementielles (transports, logistique, sécurité) 

 * Participer à la restitution des analyses lors des réunions quotidiennes avec les différentes directions et le CIO pendant la période des Jeux 

 * Vérifier en continue la qualité et la cohérence des données, garantir la maintenance des dashboards, en particulier pendant la période des Jeux 

 * Le cas échéant, mettre en place des modèles dextrapolation, de prédiction et de scoring 

 

Vos atouts pour réussir : 

 

 * Niveau bac+5 Ecole dingénieur, dinformatique ou Master en data analyse / data management 

 * 2 à 4 ans dexpérience en analyse de données, en entreprise ou cabinet de conseil 

 * Vous maitrisez au moins un outil de restitution et de visualisation de données type Business Intelligence (Reeport, PowerBI) 

 * Vous connaissez les principaux langages de traitement de données (SQL, Python, R) et les solutions datawarehouse de type Google BigQuery 

 * Vous êtes initié aux problématiques data associées aux outils CRM comme Salesforce 

 * Vous avez un esprit danalyse et de synthèse, vous êtes rigoureux et avez le sens de lorganisation 

 * Vous êtes proactif et avez de bonnes compétences relationnelles 

Rejoindre Paris 2024 cest rejoindre une équipe guidée par des valeurs fortes :

Le Partage : Cest lambition de faire avec","
Contrat à durée indéterminée

Contrat travail
",unspecified,unspecified,unspecified,Unspecified,Débutant accepté,Contrat à durée indéterminée,True
5668763,https://candidat.pole-emploi.fr/offres/recherche/detail/5668763,2024-04-22,Offre d'emploi CDI - DATA ANALYST SENIOR AFRIQUE - (F/H/X) (H/F) - 92 - ISSY LES MOULINEAUX - 5668763 | France Travail,92 - ISSY LES MOULINEAUX,"Bienvenue chez CANAL+ Group ! Séries, films, documentaires, émissions, sports, Ce qui nous tient à cœur cest de créer les meilleurs contenus et une expérience immersive pour nos millions dabonnés : émotions et sensations garanties ! Et si vous passiez derrière lécran ? Vous trouverez forcément votre place parmi nos 7 600 passionnés dans le monde !
CANAL+INTERNATIONAL est la filiale du GROUPE CANAL+ en charge de l'International et de l'Outremer français. CANAL+INTERNATIONAL est présent sur plus de 40 territoires en Afrique subsaharienne, en Europe de l'Est, en Asie et en Outremer, et dispose dun parc de près de 16 millions dabonnés. En forte croissance depuis plusieurs années, le GROUPE poursuit son expansion avec l'ouverture de nouvelles filiales, la diversification de ses activités à l'international, et un nombre croissant de collaborateurs (+ de 4500 collaborateurs dans le monde)
 Au sein de la Direction Commerciale et Marketing de CANAL+INTERNATIONAL, la Direction Analyse & Pilotage de la Performance occupe un rôle clé dans la prise de décision. Les data analysts qui la composent mettent à profit toutes leurs compétences pour :
- Rendre disponible les dashboards de suivi de KPIs à lensemble des équipes de CANAL+INTERNATIONAL partout dans le monde via notre application #Data4all disponible sur PowerBI
- Transformer les data en inputs et recommandations business, et aider les équipes dans leurs prises de décisions
Les sujets sont nombreux et variés et touchent quasiment tous les métiers : analyse des schémas de promotion, estimation dimpact des nouvelles offres et services, analyse de la performance de nos contenus, analyse des performances de notre marketing direct, 
Léquipe propose et développe également les outils qui permettront daccroître la connaissance de nos abonnés, en exploitant lensemble des data à disposition. La richesse de notre database vient de la variété des données collectées, allant des données de contrats aux données de navigation et dusage sur nos décodeurs et notre application myCANAL. Léquipe exploite aussi les outils de machine learning pour identifier des profils dabonnés et contribuer à la personnalisation de nos actions marketing.
 Rattaché à la direction dAnalyse et du Pilotage de la Performance, le Data Analyst Afrique a un rôle essentiel dans la prise de décisions des équipes business qui opèrent sur le périmètre africain.
 Et vos missions :
- Développer/maintenir les dashboards de suivi de KPIs hébergés dans notre application #Data4all, avec laide de notre cellule dexperts PowerBI opérant depuis la Pologne
- Exploiter la richesse des données à sa disposition pour les transformer en recommandations business qui aideront à la prise de décision
- Être le point dentrée de léquipe sur des projets danalyse concernant le marché africain
- Présenter les résultats danalyses aux équipes concernées en faisant preuve de pédagogie et dexpertise
- Proposer/créer les outils de scoring/segmentation qui contribueront à mieux connaître nos profils dabonnés et personnaliser nos actions marketing
 Et si on parlait de vous ?
- Bac+4-5 en statistiques/datamining/data science ou école de commerce/ingénieur avec spécialisation data
- Première expérience de 4 ans minimum en tant que data analyst
- Forte appétence pour lanalyse des données au service de prises de décisions business
- En mesure dexploiter les outils de manipulation de données (SQL, SAS enterprise guide, Python) et de construction de dashboards (PowerBI).
 Les +
- Un abonnement CANAL+ pour être incollable sur nos univers !
- Des avant-premières de films et séries dans notre salle de cinéma
- Des visites de nos plateaux et des participations à nos émissions
- Participation éressement
- CSE attractif : chèques vacances et noël, prime mariage / pacs / naissance, réduction billetterie sport / voyages / loisirs, prise en charge dune partie de votre abonnement sportif, 
- Et parce que nous voulons vous aider à vous épanouir et vous perfectionner : des formations régulières, des participations à des conférences en interne ou en externe,  !
En tant que média, producteur et distributeur de contenus, le Groupe CANAL+ a une responsabilité particulière. En interne ou à lécran, nous soutenons une création ambitieuse, inclusive et respectueuse des limites planétaires.
 On agit pour légalité entre les femmes et les hommes, contre toute forme de discrimination ou harcèlement
 On agit pour légalité des chances et linclusion de tous et toutes
 On agit pour réduire notre impact environnemental et éco-concevoir nos produits
Si vous voyez cette annonce, cest que vous avez votre chance et que nous navons pas encore trouvé la perle rare !
 Seulement chez CANAL+ à Issy-Les-Moulineaux (92)","
Contrat à durée indéterminée

Contrat travail
",unspecified,unspecified,unspecified,Unspecified,Débutant accepté,Contrat à durée indéterminée,True
5658256,https://candidat.pole-emploi.fr/offres/recherche/detail/5658256,2024-04-22,Offre d'emploi SENIOR FULLSTACK DEVELOPER- JAVA 17 / ANGULAR F/H - Informatique de gestion (H/F) - 75 - PARIS 09 - 5658256 | France Travail,75 - PARIS 09,"Descriptif du poste:

Vous intégrez les équipes de développement organisées en Squad : Data Scientist, ML, ingénieurs logiciels, PM (sprints de 3 semaines).
Poste orienté Frontend.

 Principales missions : 
Participer au développement de l'architecture et des nouvelles features, où la logique métier -tant côté Front que Back- peut être complexe, et le volume de données traitées considérable
Travailler sur des problématiques techniques très variées telles que : le rendu des données (graphiques, canvas)/  performance et réactivité du site web/ processus simultanés asynchrones/ optimisation du calcul
Travailler avec l'ensemble des équipes concernées et accompagner la montée en compétence des profils juniors

Stack:
Angular 16+, Typescript / Java 17 (Spring)
PostgreSQL, Docker, AWS

Profil recherché:

Issu(e) d'une école d'ingénieurs, vous avez min. 4 ans d'expérience sur un poste Fullstack ou Frontend.

Compétences requises : 
Bonne connaissance d'un framework frontend JS moderne 
Expérience précédente sur du développement de fonctionnalités impliquant de grands volumes de données et l'optimisation de l'architecture
Avoir des bases en mathématiques/algorithmique
Anglais écrit et oral

Compétences appréciées : 
Bonne connaissance de l'environnement Java Spring","
Contrat à durée indéterminée

Contrat travail
",unspecified,unspecified,unspecified,Caraz,Expérience exigée de 4 An(s),Contrat à durée indéterminée,False
5668145,https://candidat.pole-emploi.fr/offres/recherche/detail/5668145,2024-04-22,Offre d'emploi Développeur Datascience Flux Vision F/H (H/F) - 86 - POITIERS - 5668145 | France Travail,86 - POITIERS,"La croissance très importante du volume des données transitant sur le réseau mobile est à la fois une contrainte pour le dimensionnement des infrastructures et une opportunité de création de valeur pour Orange. Flux Vision est une offre d'Orange Business Services proposant un ensemble de services de mesures de fréquentation des territoires et de mobilités des personnes, en exploitant une plateforme d'analyse des données de signalisation des mobiles sur le réseau Orange. Flux Vision offre une large gamme d'indicateurs statistiques permettant aux acteurs économiques de mieux comprendre les territoires, avec applications dans des domaines clés tels que l'observation touristique, les transports, l'aménagement du territoire ou encore le géomarketing. En quelques années, Flux Vision est devenu une référence mondiale avec plus de 200 clients actifs dans 7 pays. Les données produites peuvent avoir un impact significatif sur les décisions importantes prises par les acteurs de ces différents domaines d'application.
La diversification des champs d'applications de ces données, et l'enrichissement des offres marketing impliquent un effort continue de conception de modèles et de développement d'algorithmes de traitement, afin d'augmenter la valeur analytique et prédictive des données restituées à nos clients. D'une grande diversité, ces modèles associent les connaissances du monde des réseaux mobiles, des mathématiques appliquées, des sciences de l'information et tirent le meilleur des outils de la Data Science et du Big Data.
Dans le cadre du développement du service Flux Vision, tant en France qu'à l'international, nous cherchons une personne pour renforcer l'équipe de développement :
L'équipe Flux Vision travaille en mode intégré (Marketing / Dev / Analystes / OPS) et est constituée d'environ 40 personnes, réparties principalement entre deux sites, Belfort et Rennes.
Au sein de cette équipe, votre mission consistera à développer et faire évoluer les composants logiciels de la chaîne de production Flux Vision. Vous serez donc amenés à dialoguer avec les datascientists et analystes pour comprendre les modèles et algorithmes à implémenter et les exploitants/devops pour satisfaire les contraintes opérationnelles (système d'exploitation, ressources des serveurs, etc).

  
 Vous êtes titulaire d'un Bac+5 master ou école d'ingénieur spécialisé en informatique. Vous avez une expérience significative en développement en python, avec sa stack datascience (librairies numpy, pandas, etc.).
Des connaissances d'autres langages (C++, Rust, Powershell, ...), en algorithmique et des hyperscalers (AWS, Azure ou GCP) seraient un plus apprécié, de même que des expériences sur des volumes importants de données.
Dynamique, doté(e) d'un bon relationnel, vous avez le sens de l'équipe, et faites preuve d'initiatives.
Vos capacités d'analyse et de synthèse des problématiques vous permettent une autonomie suffisante pour piloter une activité et communiquer clairement avec les autres contributeurs de l'équipe.
Vous souhaitez intégrer une structure qui saura être à l'écoute de votre potentiel et qui vous permettra d'évoluer, alors envoyez sans plus attendre votre candidature !","
Contrat à durée indéterminée

Contrat travail
",unspecified,30000.0,35000.0,Orange business,Débutant accepté,Contrat à durée indéterminée,True
5657764,https://candidat.pole-emploi.fr/offres/recherche/detail/5657764,2024-04-22,"Offre d'emploi Spécialiste Data Science / Dataiku F/H - Système, réseaux, données (H/F) - 77 - MONTEREAU SUR LE JARD - 5657764 | France Travail",77 - MONTEREAU SUR LE JARD,"Descriptif du poste:

Chez Safran Aircraft Engines, la Digital Factory est le moteur de notre transformation numérique. Sa raison d'être est de créer et délivrer des produits et services innovants en exploitant les technologies de pointe. Dans le cadre de notre expansion, nous sommes à la recherche d'un(e) Expert Dataiku pour rejoindre une équipe dédiée à l'innovation, la Data et l'amélioration continue.

En tant qu'expert(e) Dataiku, vous jouerez un rôle essentiel dans notre équipe en contribuant au développement, à la mise en oeuvre et à l'optimisation de solutions de data science et d'analyse prédictive basées sur la plateforme Dataiku.
Vos principales responsabilités comprendront :

- Concevoir et développer des workflows, des modèles prédictifs et des tableaux de bord en utilisant les fonctionnalités avancées de Dataiku.
- Collaborer avec les équipes métier pour comprendre leurs besoins analytiques et développer des solutions répondant à ces besoins.
- Participer à la collecte, à l'intégration et à la manipulation de données provenant de différentes sources pour alimenter les modèles et les analyses.
- Assurer la qualité des données utilisées dans les projets et mettre en oeuvre des processus de validation et de nettoyage.
- Évaluer les performances des modèles, effectuer des ajustements et des améliorations pour garantir leur précision et leur robustesse.
- Fournir un support technique et des conseils aux utilisateurs internes de Dataiku, notamment en matière de bonnes pratiques et de résolution de problèmes.
 

Profil recherché:

Formation et expérience :
Diplôme universitaire en informatique, en data science, en statistiques ou dans un domaine connexe.
Expérience professionnelle d'au moins 3 ans dans un rôle similaire, avec une expertise pratique dans l'utilisation de la plateforme Dataiku.

Compétences techniques :
Excellente maîtrise de la plateforme Dataiku, y compris la conception de workflows, la manipulation de données et le développement de modèles prédictifs.
Solides compétences en programmation (Python, R, SQL, etc.) et en statistiques.
Connaissance des concepts clés de l'apprentissage automatique et de l'analyse prédictive.

Compétences interpersonnelles :
Capacité à communiquer efficacement avec des équipes multidisciplinaires et à traduire les besoins métier en solutions techniques.
Esprit d'analyse et de résolution de problèmes, avec une attention aux détails.
Capacité à travailler de manière autonome et à gérer plusieurs projets simultanément.

Merci de l'intérêt que vous portez à Safran et nous sommes impatients de discuter avec vous de cette opportunité excitante.
 ","
Contrat à durée indéterminée

Contrat travail
",unspecified,unspecified,unspecified,Safran aircraft engines,Expérience exigée de 3 An(s),Contrat à durée indéterminée,False
